Id,Screen_name,Created_at,Retweet,Text,Hashtags,Sentiment,Compound,Ents
1598457203291484163,sisonokevin,2022-12-01 23:21:09+00:00,34,"Comunque la falsità di Sarah che dietro sparla di Nikita e poi davanti fa tutta l'amica parlando tranquillamente anche no, è proprio imbarazzante. gfvip  nikiters  incorvassi ",#gfvip#nikiters#incorvassi,3,0.0,Sarah;Nikita
1598457180243562497,ycnarf0305,2022-12-01 23:21:04+00:00,108,"perché se incontrarsi resta una magia, è non perdersi la vera favola ✨💘  donnalisi  GFvip ",#donnalisi#GFvip,5,0.7579,
1598457148924915714,Fatima23816665,2022-12-01 23:20:56+00:00,4,Oriana è il solo motivo per cui sto guardando il  gfvip ! oriana  orianistas,#gfvip#oriana#orianistas,3,0.0,Oriana
1598457131170136065,a_folvini,2022-12-01 23:20:52+00:00,108,"perché se incontrarsi resta una magia, è non perdersi la vera favola ✨💘  donnalisi  GFvip ",#donnalisi#GFvip,5,0.7579,
1598457118528622593,saggioilmatto,2022-12-01 23:20:49+00:00,0,Ma vattene affanculo te e 3/4 della palazzina tuaTavassi Tom4s mili4nGrande🤣  gfvip  nikiters,#gfvip#nikiters,4,0.4939,
1598457106084278272,lillalalu,2022-12-01 23:20:46+00:00,2, Io no credo che Luca a Nikita tenga ma voi non siete pronti per questo discorso ricordatevi che l'amicizia è la forma d'amore più grande  gfvip  nikiters,#gfvip#nikiters,2,-0.296,Luca;Luca;Nikita
1598457076207976448,BerAliona,2022-12-01 23:20:39+00:00,3,La bellezza di questa donna. gfvip  nikiters ,#gfvip#nikiters,3,0.0,
1598457069178429442,Claudio06893830,2022-12-01 23:20:37+00:00,0,Cioè ma solo a me niki sembra un po impostata ? Non so nn la capisco ad ora.... boh cmq preferisco sentirmi i  tavassi ...  gfvip  nikiters,#tavassi#gfvip#nikiters,1,-0.5574,
1598457058612871168,_Stef_SM,2022-12-01 23:20:35+00:00,4,"""Ma vattene a fanculo te e tre quarti della palazzina tua""⚰⚰⚰EDOARDO TI PREGO MI PISCIO GFvip  incorvassi",#GFvip#incorvassi,3,0.0,
1598457022927687681,Rose43652647,2022-12-01 23:20:26+00:00,28,E: Antonella mi dice le cose carine su Micol a bassa voce per non farsi sentire da Micol. Si vergogna di dirla ad alta voce.T: ANTONELLA È BUONA!E-T-M insieme: ANTONELLA È BUONA! T: Cosa hai detto?A: Che è simpatica e dolce. 💜 GFVIP  donnalisi  incorvassi ,#GFVIP#donnalisi#incorvassi,5,0.6988,Micol;Antonella
1598457005085179904,anna_ursula,2022-12-01 23:20:22+00:00,4,"Sinceramente preferisco persone sincere come Onestini Micol e George che comunque possono essere di sostegno per Nikita a prescindere,che gente banderuola! oggi c'è per modo di dire e poi ti fanno a merda alle spalle 😏  gfvip  nikiters",#gfvip#nikiters,3,-0.1511,Micol;George;Nikita
1598456973896433664,Elisabe82157594,2022-12-01 23:20:15+00:00,2,"Nikita è imbarazzante se prende un palo, altri no, ma io so già il perché… iostoconnikita  nikiters   gfvip ",#iostoconnikita#nikiters#gfvip,3,0.0,
1598456963897196548,anna_ursula,2022-12-01 23:20:12+00:00,2, Io no credo che Luca a Nikita tenga ma voi non siete pronti per questo discorso ricordatevi che l'amicizia è la forma d'amore più grande  gfvip  nikiters,#gfvip#nikiters,2,-0.296,Luca;Luca;Nikita
1598456962370486274,Auro_27,2022-12-01 23:20:12+00:00,50,Edo corre subito da Micol 🥹 incorvassi  GFvip ,#incorvassi#GFvip,3,0.0,Micol
1598456904069648384,RaffyComics,2022-12-01 23:19:58+00:00,28,E: Antonella mi dice le cose carine su Micol a bassa voce per non farsi sentire da Micol. Si vergogna di dirla ad alta voce.T: ANTONELLA È BUONA!E-T-M insieme: ANTONELLA È BUONA! T: Cosa hai detto?A: Che è simpatica e dolce. 💜 GFVIP  donnalisi  incorvassi ,#GFVIP#donnalisi#incorvassi,5,0.6988,Micol;Antonella
1598456887246483461,pupapeligrosah,2022-12-01 23:19:54+00:00,53,"“Ma menomale che Nikita viene a parlare se ha qualcosa da dire, almeno è sincera, invece ci sono altri che non lo fanno e poi vedi le clip in puntata”MICOL CHE DIFENDE NIKITA GRAZIE 🤍 gfvip  nikiters  incorvassi ",#gfvip#nikiters#incorvassi,3,-0.1531,Nikita
1598456878924812288,BerAliona,2022-12-01 23:19:52+00:00,14,"One:oggi è stata 1bruttissima giornata,nn mi hai parlato Nik:ma ieri hai detto che sono tua amica mi sono comportata da taleOne:t ho detto che sto bene con te e nn ho detto ne che nn può nascere nulla ne che nasceràNiki: allora mi proteggo  gfvip  nikiters",#gfvip#nikiters,3,0.0,
1598456862780919808,Fatima23816665,2022-12-01 23:19:48+00:00,21,"Oriana""Perche' Antonino ha detto che non gli parla di me quando gli ho raccontato della mia famiglia, di mia mamma e di mio padre! Lui racconta solo quello che vuole!""Grande Oriana, sta descrivendo e asfaltando il Burattinaio!🔥🔥🔥🔥 gfvip  oriana  orianistas  iostoconoriana",#gfvip#oriana#orianistas#iostoconoriana,1,-0.8879,Antonino
1598456842837004295,BAliceB90,2022-12-01 23:19:43+00:00,9," INCORVASSI  GFvip La ""sigaretta"" (Pt.1) ",#INCORVASSI#GFvip,3,0.0,
1598456834637152258,filly566971211,2022-12-01 23:19:41+00:00,39,"Nikita ""mi hai raccontato tornando da Spagna non riuscivi a parlare italiano e chi c'è rimasto male? TUO NONNO?""Luca ""tuo nonno?TONON il mio amicone!"" ahahahah  gfvip  nikiters ",#gfvip#nikiters,3,0.0,
1598456785324896257,MDaje7,2022-12-01 23:19:30+00:00,4,"Sinceramente preferisco persone sincere come Onestini Micol e George che comunque possono essere di sostegno per Nikita a prescindere,che gente banderuola! oggi c'è per modo di dire e poi ti fanno a merda alle spalle 😏  gfvip  nikiters",#gfvip#nikiters,3,-0.1511,Micol;George;Nikita
1598456735009841153,lorisz841,2022-12-01 23:19:18+00:00,4,Hahahahah Sarah ha preso subito il palo da Onestini che gli fa il dito medio con la mano di Nikita🤣⚰️  gfvip  nikiters,#gfvip#nikiters,5,0.6808,Sarah;Nikita
1598456729229983745,Mel51987,2022-12-01 23:19:16+00:00,2,Raga dai possiamo dirlo che antonella è diventata la vostra capoship stasera?!?  donnalisi for  incorvassi 🥰🥰  gfvip,#donnalisi#incorvassi#gfvip,5,0.9456,
1598456728349298688,justdonnalisi,2022-12-01 23:19:16+00:00,28,E: Antonella mi dice le cose carine su Micol a bassa voce per non farsi sentire da Micol. Si vergogna di dirla ad alta voce.T: ANTONELLA È BUONA!E-T-M insieme: ANTONELLA È BUONA! T: Cosa hai detto?A: Che è simpatica e dolce. 💜 GFVIP  donnalisi  incorvassi ,#GFVIP#donnalisi#incorvassi,5,0.6988,Micol;Antonella
1598456704697516032,Annarells,2022-12-01 23:19:10+00:00,15,"Nikita: “Di cosa hanno parlato in piscina?”Onestini: “Sarah di cosa avete parlato?”Sarah: “Non si dice, chiacchiere tra donne”SE SOLO NIKITA SAPESSE 😭 gfvip  nikiters  incorvassi",#gfvip#nikiters#incorvassi,2,-0.5362,Sarah
1598456703632261120,tzsoempire,2022-12-01 23:19:10+00:00,44,"Luca.O: “Mi avresti iniziato a trattare come?”Nikita: “Tipo buongiorno, dormito Bene? Si, no”Luca.O: “Allora non te ne frega niente neanche della nostra amicizia, te ne fotti di me”Nikita: “Non è che me ne fotto, mi proteggo”NIKITA FALLO PERÒ ❤ gfvip  nikiters  incorvassi ",#gfvip#nikiters#incorvassi,5,0.6767,
1598456692022337538,BAliceB90,2022-12-01 23:19:07+00:00,2,Edo e Micol finalmente chiariscono ❤️  incorvassi  GFvip ,#incorvassi#GFvip,3,0.0,Micol
1598456662058319872,Codename1onesto,2022-12-01 23:19:00+00:00,0,  GFvip Quando è successo? Ha parlato male di Micol con qualcuno? INCORVASSI,#GFvip#INCORVASSI,4,0.4137,Micol
1598456660615639041,lorisz841,2022-12-01 23:19:00+00:00,4,Hahahahah Sarah ha preso subito il palo da Onestini che gli fa il dito medio con la mano di Nikita🤣⚰️  gfvip  nikiters,#gfvip#nikiters,5,0.6808,Sarah;Nikita
1598456654928007175,catalani_lisa,2022-12-01 23:18:59+00:00,2,"Nikita è imbarazzante se prende un palo, altri no, ma io so già il perché… iostoconnikita  nikiters   gfvip ",#iostoconnikita#nikiters#gfvip,3,0.0,
1598456635176927233,cgxx178,2022-12-01 23:18:54+00:00,31,"Antonella ""guarda che la vedo trist-"" *edot parte subito e la abbraccia*edod ""neanche il tempo di dirlo ed è partito subito.""❤️‍🩹❤️‍🩹 gfvip  incorvassi ",#gfvip#incorvassi,3,0.0,Antonella
1598456635105615873,_giogioooooo_,2022-12-01 23:18:54+00:00,28,E: Antonella mi dice le cose carine su Micol a bassa voce per non farsi sentire da Micol. Si vergogna di dirla ad alta voce.T: ANTONELLA È BUONA!E-T-M insieme: ANTONELLA È BUONA! T: Cosa hai detto?A: Che è simpatica e dolce. 💜 GFVIP  donnalisi  incorvassi ,#GFVIP#donnalisi#incorvassi,5,0.6988,Micol;Antonella
1598456632077606913,tzsoempire,2022-12-01 23:18:53+00:00,53,"“Ma menomale che Nikita viene a parlare se ha qualcosa da dire, almeno è sincera, invece ci sono altri che non lo fanno e poi vedi le clip in puntata”MICOL CHE DIFENDE NIKITA GRAZIE 🤍 gfvip  nikiters  incorvassi ",#gfvip#nikiters#incorvassi,3,-0.1531,Nikita
1598456578159550467,cgxx178,2022-12-01 23:18:40+00:00,3,Edoardo incazzato nero e lo capisco eccome   incorvassi gfvip,#incorvassi#gfvip,3,0.0,Edoardo;Edoardo
1598456574674366466,MariannaTorto11,2022-12-01 23:18:39+00:00,3,La bellezza di questa donna. gfvip  nikiters ,#gfvip#nikiters,3,0.0,
1598456571620913152,pallanteceleste,2022-12-01 23:18:39+00:00,28,E: Antonella mi dice le cose carine su Micol a bassa voce per non farsi sentire da Micol. Si vergogna di dirla ad alta voce.T: ANTONELLA È BUONA!E-T-M insieme: ANTONELLA È BUONA! T: Cosa hai detto?A: Che è simpatica e dolce. 💜 GFVIP  donnalisi  incorvassi ,#GFVIP#donnalisi#incorvassi,5,0.6988,Micol;Antonella
1598456550607458305,desi_donnalisi,2022-12-01 23:18:34+00:00,10,Sei l’unico che mi calma❤️ donnalisi  drojette  fiorde  gfvip ,#donnalisi#drojette#fiorde#gfvip,3,0.0,
1598456543988838402,valen_mess_,2022-12-01 23:18:32+00:00,61,"Edoardo: “Ogni volta che arriva un aereo per qualcuno altro, un'Antonella nel mondo muore”MIO DIO TAVASSIIIIIII gfvip  incorvassi ",#gfvip#incorvassi,3,0.0,Edoardo;Edoardo;Antonella
1598456540222087171,TZSOFOAZ,2022-12-01 23:18:31+00:00,23,"giale che dice che se ne sono accorti tutti che Nikita stava a piangere da sola in vasca pero nessuno se non luca ha provato ad avvicinarsi, questa è veramente una cosa brutta. dalla storia di marco avete imparato 0  iostoconnikita  nikiters  gfvip",#iostoconnikita#nikiters#gfvip,4,0.34,Nikita;Luca;Luca
1598456523004444672,GiadaGiadasedda,2022-12-01 23:18:27+00:00,39,"Dopo 75 giorni di attacchi , dopo 75 giorni di derisione , ci sta piangere ci sta crollare , ci sta sfogarsi con se stessa . Serve piangere serve a comprendere e scaricare tutto ciò che sta dentro se stessi ❤️🥹  gfvip  incorvassi  nikiters  ",#gfvip#incorvassi#nikiters,3,0.0,
1598456505174560768,Ferdy897,2022-12-01 23:18:23+00:00,0,Ao che palle Nikita e Luca da 3 oreee però dai I  donnalisi solo se si litiga io dico non inquadrarli sempre ma. Manco a fa così  GFvip,#donnalisi#GFvip,3,0.0,Nikita;Luca;Luca
1598456499176611841,Paola61513176,2022-12-01 23:18:21+00:00,2, Io no credo che Luca a Nikita tenga ma voi non siete pronti per questo discorso ricordatevi che l'amicizia è la forma d'amore più grande  gfvip  nikiters,#gfvip#nikiters,2,-0.296,Luca;Luca;Nikita
1598456451697201153,Chaz_Lannie,2022-12-01 23:18:10+00:00,16,"""a me lo ha detto Giaele""""impossibile io non l'ho detto a Giaele""""ma lei origlia sempre""LA MILIARDARIA SIGNORE E SIGNORI  gfvip  incorvassi ",#gfvip#incorvassi,4,0.34,Giaele
1598456446047424512,Lexy6789,2022-12-01 23:18:09+00:00,10,Sei l’unico che mi calma❤️ donnalisi  drojette  fiorde  gfvip ,#donnalisi#drojette#fiorde#gfvip,3,0.0,
1598456445003042817,soniakrisiempre,2022-12-01 23:18:09+00:00,69,"Oriana:"" dov'è la telecamera? Io ora voglio dire a Sonia di dire la prossima puntata cosa ne pensa che sta piangendo dopo 4 giorni (Nikita)  VOGLIO PROPRIO SAPERE visto che io ero un'attrice"" ORIAAAANAAAAAA TI AMO AHAHAHAH gfvip  donnalisi",#gfvip#donnalisi,1,-0.7184,
1598456441442299908,NeisaCabello,2022-12-01 23:18:08+00:00,69,"Oriana:"" dov'è la telecamera? Io ora voglio dire a Sonia di dire la prossima puntata cosa ne pensa che sta piangendo dopo 4 giorni (Nikita)  VOGLIO PROPRIO SAPERE visto che io ero un'attrice"" ORIAAAANAAAAAA TI AMO AHAHAHAH gfvip  donnalisi",#gfvip#donnalisi,1,-0.7184,
1598456440318234624,sweetrose2022,2022-12-01 23:18:07+00:00,1,Che due coglioni sta regia ancora su Nikita  e onestini ma basta esistono altre persone  GFVIP   donnalisi,#GFVIP#donnalisi,3,0.0,Nikita
1598456429891014656,trupponoemi02,2022-12-01 23:18:05+00:00,28,E: Antonella mi dice le cose carine su Micol a bassa voce per non farsi sentire da Micol. Si vergogna di dirla ad alta voce.T: ANTONELLA È BUONA!E-T-M insieme: ANTONELLA È BUONA! T: Cosa hai detto?A: Che è simpatica e dolce. 💜 GFVIP  donnalisi  incorvassi ,#GFVIP#donnalisi#incorvassi,5,0.6988,Micol;Antonella
1598456397406113792,eccomi33,2022-12-01 23:17:57+00:00,0, GFvip ascoltate bene quello che Dice MICOL Io adesso non sono INTERESSATASI AGGIRA NELL'ARIA UN ALTRO 2♠️ INCORVASSI  micol  EdoardoTavassi  donnalisi  GFVipOriana  nikita  nikiters  LucaOneGFVip ,#GFvip#INCORVASSI#micol#EdoardoTavassi#donnalisi#GFVipOriana#nikita#nikiters#LucaOneGFVip,3,0.0,Micol;Edoardo;Edoardo;Oriana
1598456383040811008,MDaje7,2022-12-01 23:17:54+00:00,3,"One:oggi è stata 1bruttissima giornata,nn mi hai parlato Nik:ma ieri hai detto che sono tua amica mi sono comportata da taleOne:t ho detto che sto bene con te e nn ho detto ne che nn può nascere nulla ne che nasceràNikita: allora mi proteggo  gfvip  nikiters ",#gfvip#nikiters,3,0.0,
1598456359485415424,BlissHoll,2022-12-01 23:17:48+00:00,28,E: Antonella mi dice le cose carine su Micol a bassa voce per non farsi sentire da Micol. Si vergogna di dirla ad alta voce.T: ANTONELLA È BUONA!E-T-M insieme: ANTONELLA È BUONA! T: Cosa hai detto?A: Che è simpatica e dolce. 💜 GFVIP  donnalisi  incorvassi ,#GFVIP#donnalisi#incorvassi,5,0.6988,Micol;Antonella
1598456345883205632,KMacelloni,2022-12-01 23:17:45+00:00,9,"Nooo Nikita che cercava le 4 ragazze in piscina x parlare con loro se pensasse che stavano parlando male di lei. Poi dite che lei è la cattiva, che le guarda male Nikita è una fessa che si fida di tutti e sbaglia🥺 gfvip  nikiters",#gfvip#nikiters,3,0.0,Nikita
1598456341131104256,Codename1onesto,2022-12-01 23:17:44+00:00,0, GFvip nascono gli  Altoromit la fusione tra Altobello e Romita.Nei migliori cinema 😂 nikiters  INCORVASSI,#GFvip#Altoromit#nikiters#INCORVASSI,4,0.4404,
1598456309212487680,MariannaTorto11,2022-12-01 23:17:36+00:00,39,"Nikita ""mi hai raccontato tornando da Spagna non riuscivi a parlare italiano e chi c'è rimasto male? TUO NONNO?""Luca ""tuo nonno?TONON il mio amicone!"" ahahahah  gfvip  nikiters ",#gfvip#nikiters,3,0.0,
1598456290690453512,sonovalentina1,2022-12-01 23:17:32+00:00,108,"perché se incontrarsi resta una magia, è non perdersi la vera favola ✨💘  donnalisi  GFvip ",#donnalisi#GFvip,5,0.7579,
1598456286722809856,nevrotika,2022-12-01 23:17:31+00:00,2,Raga dai possiamo dirlo che antonella è diventata la vostra capoship stasera?!?  donnalisi for  incorvassi 🥰🥰  gfvip,#donnalisi#incorvassi#gfvip,5,0.9456,
1598456259686047744,Verovera_01,2022-12-01 23:17:24+00:00,4,"Sinceramente preferisco persone sincere come Onestini Micol e George che comunque possono essere di sostegno per Nikita a prescindere,che gente banderuola! oggi c'è per modo di dire e poi ti fanno a merda alle spalle 😏  gfvip  nikiters",#gfvip#nikiters,3,-0.1511,Micol;George;Nikita
1598456236785254402,MariannaTorto11,2022-12-01 23:17:19+00:00,5,"Ma voi in""coppia""fate solo i cazzari o parlate anche d cose serie? Mica Nikita e One possono solo  far ridere,c sono i momenti in cui s raccontanoVI RICORDO CHE È STATO LUI CHE È ANDATO DA LEI INCAZZATO XCHÉ LEI OGGI NN C PARLAVAquindi xché rompete le⚽a Nikita  gfvip  nikiters",#gfvip#nikiters,3,0.0,Nikita
1598456219269840898,cgxx178,2022-12-01 23:17:15+00:00,11,"EdoT: “Io ti giuro credimi questa cosa la soffro in generale, sono sempre io a cercare, mi sei venuta tu a parlarmi, mo potevo stare qua 7 ore,sai chi veniva? Sto cazzo” Stasera mi sta spezzando il cuore Edo 💔💔💔  incorvassi gfvip",#incorvassi#gfvip,5,0.6486,
1598456204069638145,_burningstone,2022-12-01 23:17:11+00:00,11,TI RINGRAZIO MIO SIGNORE NON HO PIU PAURA  gfvip  incorvassi ,#gfvip#incorvassi,3,0.0,
1598456194137747461,MariannaTorto11,2022-12-01 23:17:09+00:00,11,Nikita che chiede di cosa hanno parlato in piscina?Il suo sesto senso se lo immagina 🤭 nikiters  gfvip ,#nikiters#gfvip,4,0.4939,
1598456172516093953,lunatica1994,2022-12-01 23:17:04+00:00,0,Tavassi è cotto proprio a pennello ahahah  gfvip  donnalisi,#gfvip#donnalisi,3,0.0,
1598456156153864194,cgxx178,2022-12-01 23:17:00+00:00,16,"""a me lo ha detto Giaele""""impossibile io non l'ho detto a Giaele""""ma lei origlia sempre""LA MILIARDARIA SIGNORE E SIGNORI  gfvip  incorvassi ",#gfvip#incorvassi,4,0.34,Giaele
1598456120645152774,alan_hibic,2022-12-01 23:16:51+00:00,7,Finalmente un bel sorriso!🫶  GFvip  LucaOneGFVip  nikita  nikiters  iostoconnikita ,#GFvip#LucaOneGFVip#nikita#nikiters#iostoconnikita,3,0.0,
1598456087300214785,MDaje7,2022-12-01 23:16:43+00:00,39,"Nikita ""mi hai raccontato tornando da Spagna non riuscivi a parlare italiano e chi c'è rimasto male? TUO NONNO?""Luca ""tuo nonno?TONON il mio amicone!"" ahahahah  gfvip  nikiters ",#gfvip#nikiters,3,0.0,
1598456062595702785,Gina35415084,2022-12-01 23:16:37+00:00,9,Sarah: Un conto è se ti metti in mezzo ad una coppiaGiaele: Tipo EdoardoSarah: Di coppia reale c’è ne una in casaOriana: Si giustoGiaele: C’è solo una vera coppia qua.Micol: Ed è giusto ma gli altri?Non ti puoi avvicinare a uno che l’altra si arrabbia  donnalisi  GFVIP 👏🏻 ,#donnalisi#GFVIP,3,0.0,Sarah;Edoardo;Edoardo
1598456046582104064,saggioilmatto,2022-12-01 23:16:34+00:00,0,Preferisco quando Tavassi parla con Nikita che con Micol  nikiters  gfvip,#nikiters#gfvip,3,0.0,Nikita;Micol
1598456043603988480,paolo_caciolli,2022-12-01 23:16:33+00:00,0,Mi ricorda BB.Bellissima ❤️ oriana  GFvip ,#oriana#GFvip,3,0.0,
1598456033831432193,Iliveofmydreams,2022-12-01 23:16:30+00:00,58,"Patrizia: “Lei (Wilma) è seria quando mi dice queste cose (su Daniele)”Alberto: “Beh amore, ma io son preoccupato allora”LUI RAPPRESENTANDO TUTTI NOI 💀 gfvip  thepisis  incorvassi  nikiters ",#gfvip#thepisis#incorvassi#nikiters,3,0.0,Patrizia;Wilma
1598456006530732033,Mel51987,2022-12-01 23:16:24+00:00,9,EdoD: Antonella mi dice le cose dolci riferite a Micol sotto voce perché non si vuole far sentireArrivano anche Tavassi e Micol e parte il coro per sfotterla “Antonella è buona che schifooo” ✈️😂 donnalisi  gfvip,#donnalisi#gfvip,4,0.4404,Micol;Antonella
1598456003288526857,MDaje7,2022-12-01 23:16:23+00:00,5,"Ma voi in""coppia""fate solo i cazzari o parlate anche d cose serie? Mica Nikita e One possono solo  far ridere,c sono i momenti in cui s raccontanoVI RICORDO CHE È STATO LUI CHE È ANDATO DA LEI INCAZZATO XCHÉ LEI OGGI NN C PARLAVAquindi xché rompete le⚽a Nikita  gfvip  nikiters",#gfvip#nikiters,3,0.0,Nikita
1598455988272644096,danicla85,2022-12-01 23:16:20+00:00,2,Edo e Micol finalmente chiariscono ❤️  incorvassi  GFvip ,#incorvassi#GFvip,3,0.0,Micol
1598455977418059776,Verovera_01,2022-12-01 23:16:17+00:00,5,"Ma voi in""coppia""fate solo i cazzari o parlate anche d cose serie? Mica Nikita e One possono solo  far ridere,c sono i momenti in cui s raccontanoVI RICORDO CHE È STATO LUI CHE È ANDATO DA LEI INCAZZATO XCHÉ LEI OGGI NN C PARLAVAquindi xché rompete le⚽a Nikita  gfvip  nikiters",#gfvip#nikiters,3,0.0,Nikita
1598455968945393666,serperuta,2022-12-01 23:16:15+00:00,16,"""a me lo ha detto Giaele""""impossibile io non l'ho detto a Giaele""""ma lei origlia sempre""LA MILIARDARIA SIGNORE E SIGNORI  gfvip  incorvassi ",#gfvip#incorvassi,4,0.34,Giaele
1598455964038201344,Lovingy86127828,2022-12-01 23:16:14+00:00,1,"Frase aereo Antonella:""Fiorde mostra la tua dolcezza, raccontati, non c'è cosa più bella❤"" fiorde  donnalisi  GFvip",#fiorde#donnalisi#GFvip,5,0.6369,
1598455929330143232,Gina35415084,2022-12-01 23:16:06+00:00,2,Cari i miei  incorvassiOra vi voglio sentire tutti ringraziare Antonella GFVIP  donnalisi,#incorvassiOra#GFVIP#donnalisi,3,0.0,Antonella
1598455915933757440,Mel51987,2022-12-01 23:16:02+00:00,4,Antonella come un  incorvassi qualunque.. ❤️ “Vai da lei che è un po’ giù “ 💔Se non fosse per il fermo immagine nella sua testa adorerebbe Micol.. gfvip  donnalisi,#incorvassi#gfvip#donnalisi,2,-0.4767,Antonella
1598455911990820864,MDaje7,2022-12-01 23:16:01+00:00,11,Nikita che chiede di cosa hanno parlato in piscina?Il suo sesto senso se lo immagina 🤭 nikiters  gfvip ,#nikiters#gfvip,4,0.4939,
1598455902285303809,sogniciavarrini,2022-12-01 23:15:59+00:00,41,"Micol su Nikita: “Però è bello, è sincera raga, cioè almeno voglio dire c'è gente che manco te lo dice e poi ti vedi le puntate...”Le altre che si lamentano di Nikita e poi c'è Micol che subito la difende quando c'è da farlo vi prego 😭🤍 gfvip  nikiters  incorvassi ",#gfvip#nikiters#incorvassi,1,-0.7269,Micol;Nikita
1598455890696445957,debora_saccon,2022-12-01 23:15:56+00:00,108,"perché se incontrarsi resta una magia, è non perdersi la vera favola ✨💘  donnalisi  GFvip ",#donnalisi#GFvip,5,0.7579,
1598455882303537152,Claudio06893830,2022-12-01 23:15:54+00:00,9,"Nooo Nikita che cercava le 4 ragazze in piscina x parlare con loro se pensasse che stavano parlando male di lei. Poi dite che lei è la cattiva, che le guarda male Nikita è una fessa che si fida di tutti e sbaglia🥺 gfvip  nikiters",#gfvip#nikiters,3,0.0,Nikita
1598455858970890240,Mirellamayadado,2022-12-01 23:15:49+00:00,15,"Giaele""Dai ce ne siamo accorti tutti che Nikita piangeva,stava lì in vasca...""Giaele tu che dici di essere tanto amica come mai non sei andata a vedere come stesse??Attenzione a chi si avvicina a Nikita,molti hanno capito che è la preferita. gfvip gintonic nikiters",#gfvip#gintonic#nikiters,3,0.0,Giaele;Nikita
1598455832408211457,Lemon____G,2022-12-01 23:15:42+00:00,9," INCORVASSI  GFvip La ""sigaretta"" (Pt.1) ",#INCORVASSI#GFvip,3,0.0,
1598455800367923202,Mariani39886135,2022-12-01 23:15:35+00:00,13,"7PERSONE OLTRE NIKITA , questo accanimento è sola cattiveria  Gfvip  nikiters ",#Gfvip#nikiters,3,0.0,Nikita
1598455797490622465,crispyfede1,2022-12-01 23:15:34+00:00,0,Noi che volevamo farli parlare. Loro che litigano per la prima volta.  gfvip  nikiters   incorvassi ,#gfvip#nikiters#incorvassi,3,0.0,
1598455793510223872,Duazfan,2022-12-01 23:15:33+00:00,4," Nikita e  Onestini: ""ragazze, di cosa avete parlato per 4 ore in piscina?"" DI VOI.Ma nessuna di loro ha avuto il coraggio di esternare i pensieri a riguardo. Appunto perché opinioni, perché non esternarle proprio con loro?Lunedì dalle clip lo scoprirete🤦‍♀️ gfvip  nikiters",#Nikita#Onestini:#gfvip#nikiters,4,0.4137,
1598455786275053568,lorisz841,2022-12-01 23:15:31+00:00,4," Nikita e  Onestini: ""ragazze, di cosa avete parlato per 4 ore in piscina?"" DI VOI.Ma nessuna di loro ha avuto il coraggio di esternare i pensieri a riguardo. Appunto perché opinioni, perché non esternarle proprio con loro?Lunedì dalle clip lo scoprirete🤦‍♀️ gfvip  nikiters",#Nikita#Onestini:#gfvip#nikiters,4,0.4137,
1598455776586395648,PecoraNerah28,2022-12-01 23:15:29+00:00,108,"perché se incontrarsi resta una magia, è non perdersi la vera favola ✨💘  donnalisi  GFvip ",#donnalisi#GFvip,5,0.7579,
1598455712648241153,biscuit__c,2022-12-01 23:15:14+00:00,0,Micol ( parlando di Giaele ) : '' Ma lei origlia sempre '' Giaele 121 🤣🤣🚀 gfvip  donnalisi,#gfvip#donnalisi,5,0.7506,Micol;Giaele
1598455710182178816,RaffyComics,2022-12-01 23:15:13+00:00,9,EdoD: Antonella mi dice le cose dolci riferite a Micol sotto voce perché non si vuole far sentireArrivano anche Tavassi e Micol e parte il coro per sfotterla “Antonella è buona che schifooo” ✈️😂 donnalisi  gfvip,#donnalisi#gfvip,4,0.4404,Micol;Antonella
1598455708902637570,Terry9024,2022-12-01 23:15:13+00:00,9,"NELLA CHE CON UN MOCIO E UN SECCHIO CI SVOLTA UNA DELLE SERATE PIU' NOIOSE DI QUEST'EDIZIONECHI COME LEI, CHIE POI MI CHIEDONO PERCHE' LA AMO 😂😂😂 fiorde  donnalisi  gfvip ",#fiorde#donnalisi#gfvip,5,0.8271,
1598455682373939202,Rita92449842,2022-12-01 23:15:07+00:00,24,Antonella è BUONA 😍♥️  donnalisi  incorvassi  gfvip ,#donnalisi#incorvassi#gfvip,5,0.802,
1598455682105315328,Mel51987,2022-12-01 23:15:07+00:00,24,"Antonella a Tavassi indicando Micol: Edo, guarda che sta un po giù. Me ne sono accorta ora.Edoardo si gira e va da Micol ad abbracciarla.Edoardo: Subito è andato.I  donnalisi sorridono alla scena.BHO SONO DIVENTATI I CAPO SHIP DEGLI  incorvassi  GFVIP ",#donnalisi#incorvassi#GFVIP,1,-0.5574,Edoardo;Edoardo;Micol
1598455657681899525,ilariscia,2022-12-01 23:15:01+00:00,108,"perché se incontrarsi resta una magia, è non perdersi la vera favola ✨💘  donnalisi  GFvip ",#donnalisi#GFvip,5,0.7579,
1598455656037904386,daenystormborn_,2022-12-01 23:15:00+00:00,16,"Il pianto silenzioso e il conforto di un proprio abbraccio, piccola Nikita quanto capisco il dolore che hai espresso in questa vasca. 💔 nikiters  incorvassi  gfvip ",#nikiters#incorvassi#gfvip,4,0.2732,Nikita
1598455629156438018,desi_donnalisi,2022-12-01 23:14:54+00:00,2,Antonella che fa da cupido a gli  incorvassi ✈Antonella che pulisce mezza casa ✈Antonella che insegue Tavassi e Onestini col mocio del bagno✈Che serata surreale 🤣✈ donnalisi  gfvip,#incorvassi#donnalisi#gfvip,4,0.4939,Antonella
1598455615722254337,Natalia98576971,2022-12-01 23:14:51+00:00,13,"7PERSONE OLTRE NIKITA , questo accanimento è sola cattiveria  Gfvip  nikiters ",#Gfvip#nikiters,3,0.0,Nikita
1598455613851418625,rosalbarosa96,2022-12-01 23:14:50+00:00,0,QUESTA SCENA AHAHAHHAAHHA  gfvip  donnalisi ,#gfvip#donnalisi,3,0.0,
