Id,Screen_name,Created_at,Retweet,Text,Hashtags,Sentiment,Compound,Ents
1597013141816487936,Anonimo0987762,2022-11-27 23:42:58+00:00,6,"Il discorso di Antonino su Luca Onestini è un discorso davvero lucido"" Come mai Luca O.  che ha fatto tanti reality si è avvicinato ai più forti Nikita e George?""Chi può dargli torto è l'evidenza.... gfvip gintonic donnalisi nikiters incorvassi",#gfvip#gintonic#donnalisi#nikiters#incorvassi,4,0.34,Antonino;Luca;Luca;Nikita
1597013122749202433,giovy_maio,2022-11-27 23:42:54+00:00,1,questi momenti qui e con le persone giuste &gt;&gt;&gt;&gt;&gt;&gt; gfvip  nikiters  incorvassi,#gfvip#nikiters#incorvassi,3,0.0,
1597013107154423808,GuglielmaciC,2022-11-27 23:42:50+00:00,27,"Ho trovato questo video su Tik Tok,ho coperto il nome per privacy.Questo video racchiude alcune delle cessate dette dalle due signore (Patrizia e Wilma) verso Micòl. Ribadisco lo SCHIFO che hanno e stanno facendo.😶  gfvip  INCORVASSI ",#gfvip#INCORVASSI,3,0.0,Patrizia;Wilma
1597013081162665984,Meri11074629,2022-11-27 23:42:44+00:00,3," GFvip  incorvassi Ma antonino sta dicendo che Onestini si è attaccato a Nikita e George  (essendo ambiguo con nikita) per le preferenze del pubblico , che è il pensiero di mezzo twitter e viene attaccato💀",#GFvip#incorvassi,3,0.0,Antonino;Nikita;George
1597013074854416384,VALE70942077,2022-11-27 23:42:42+00:00,0,Ciarly:cosa pensate d Nikita con LucaGiaele dice che Nikita è presa le sembrava strano ma ora basta vederla negli occhi Spina dice che Nikita è presa ma su Ones ha dubbi xché oltre a lei si è attaccato a George che è tutto il pacchetto vincente gfvip  nikiters  ciupilan,#gfvip#nikiters#ciupilan,4,0.34,Nikita;Luca;Luca;Giaele;George
1597013052733657088,elle_x01,2022-11-27 23:42:37+00:00,0,Chi si sente di aprire un gruppo telegram per il cortiletto?  incorvassi  nikiters  gioiellers  giacol e i fandom di Onestini e Ciupi  gfvip,#incorvassi#nikiters#gioiellers#giacol#gfvip,3,0.0,
1597013050137399296,and_denmyheart,2022-11-27 23:42:36+00:00,11,"“george sta sempre zitto,è un ignavo” George è solo selettivo e se si sente a suo agio è molto più divertente di chi lo definisce noioso,ignavo,muto e quant’altro. Se solo imparassero a rapportarsi con le persone invece di stare sempre li a fare i saputelli  incorvassi  gfvip",#incorvassi#gfvip,3,0.0,George
1597013047033614336,GuglielmaciC,2022-11-27 23:42:36+00:00,68," Gfvip  Incorvassi Carolina è stata eliminata per aver detto delle grandi verità su Wilma e Patrizia; Frustrate, egoiste, marce nel cuore. Lo stanno dimostrando denigrando pesantemente h24 una ragazza che non le hanno fatto nulla. ",#Gfvip#Incorvassi,2,-0.4588,Wilma;Patrizia
1597012940217286657,Cri2213,2022-11-27 23:42:10+00:00,0,Io davvero non capisco perché mantenere una regia fissa ogni sera su Oriana e Sara.  vogliamo il cortileeettooooo  gfvip  incorvassi,#gfvip#incorvassi,3,0.0,Oriana
1597012939793256448,AmorMicchi,2022-11-27 23:42:10+00:00,11,"“george sta sempre zitto,è un ignavo” George è solo selettivo e se si sente a suo agio è molto più divertente di chi lo definisce noioso,ignavo,muto e quant’altro. Se solo imparassero a rapportarsi con le persone invece di stare sempre li a fare i saputelli  incorvassi  gfvip",#incorvassi#gfvip,3,0.0,George
1597012923838525441,lorisz841,2022-11-27 23:42:06+00:00,15,"Cioè Spinacino dice che Onestini usa strategiaaaaaIl diavolo è nella testa di chi pensa  gfvip  lukita  nikiters Onestini è buono a differenza di Antonino, basta ricordarsi di Tonon",#gfvip#lukita#nikiters,3,0.0,Antonino
1597012893152600064,AmorMicchi,2022-11-27 23:41:59+00:00,2,"Io, aspettando che inquadrino i nostri.  nikiters  gfvip   incorvassi ",#nikiters#gfvip#incorvassi,3,0.0,
1597012892712259584,tvaddicted_ita,2022-11-27 23:41:59+00:00,0,Li amo sono perfetti l’uno per l’altra stop  gfvip  incorvassi ,#gfvip#incorvassi,2,-0.296,
1597012870717636608,alwaysgiugina,2022-11-27 23:41:54+00:00,1,Chiamalo scemo pure Spinacino...tutto ha capito GFvip donnalisi,#GFvip#donnalisi,4,0.34,
1597012860827095040,tiziana1974,2022-11-27 23:41:51+00:00,123,CLIZIA SOTTOLINEA che le uniche 2 donne a supportare micol sono state Giaele e nikita  gfvip   nikiters  incorvassi ,#gfvip#nikiters#incorvassi,3,0.0,Giaele
1597012859619196929,MariannaTorto11,2022-11-27 23:41:51+00:00,2,antonino sei in lop maaaaaaaaanbasta parlare di Nikitaaa  nikiters  gfvip,#nikiters#gfvip,3,0.0,Antonino;Nikita
1597012845337907200,viewthismona,2022-11-27 23:41:48+00:00,23,"tavassi e Micol ripetono a Luca che si è fatto lo sbiancamento a*aleNikita ""Luca va tutto bene non c'è nessun problema questi son gusti""lui si abbassa i pantaloni per farglielo vedere a tutti ahahahhahahaha  gfvip  nikiters  incorvassi ",#gfvip#nikiters#incorvassi,3,0.0,Micol;Luca;Luca
1597012839965003776,mandy___23,2022-11-27 23:41:46+00:00,1,Regiaaaaaa CORTILETTO   Gfvip  incorvassi,#Gfvip#incorvassi,3,0.0,
1597012819806806016,polemica__,2022-11-27 23:41:41+00:00,11,"“george sta sempre zitto,è un ignavo” George è solo selettivo e se si sente a suo agio è molto più divertente di chi lo definisce noioso,ignavo,muto e quant’altro. Se solo imparassero a rapportarsi con le persone invece di stare sempre li a fare i saputelli  incorvassi  gfvip",#incorvassi#gfvip,3,0.0,George
1597012808759009280,caffellattecup,2022-11-27 23:41:39+00:00,0,"Io mi vergogno, cioè davvero preferisco studiare a questo. Menomale ci siete voi che avvertite perché io tenere acceso su regie pessime basta.  cambiate proprio andazzo perché così inguardabile  gfvip  incorvassi",#gfvip#incorvassi,3,0.0,
1597012804141477888,anninaa00,2022-11-27 23:41:38+00:00,14,"Possiamo confermare stasera con certezza che loro 2 ci saranno sempre l'uno per l'altra, e nessuno li dividerà mai .. friends forever ❤️  gfvip  nikiters  ciupita ",#gfvip#nikiters#ciupita,4,0.4767,
1597012757517283328,crispyfede1,2022-11-27 23:41:27+00:00,2,"Io, aspettando che inquadrino i nostri.  nikiters  gfvip   incorvassi ",#nikiters#gfvip#incorvassi,3,0.0,
1597012751423262720,Suffo89,2022-11-27 23:41:25+00:00,1,ORA SONO SOLI E NON CE LI FAN VEDEREEEE!!!!!!  incorvassi  gfvip,#incorvassi#gfvip,5,0.6371,
1597012742900416515,Sandy___8,2022-11-27 23:41:23+00:00,1, leviamo Sarah e mettiamo il cortiletto suuuuuu gfvip  incorvassi ,#gfvip#incorvassi,3,0.0,Sarah
1597012739532021760,rosessmellike,2022-11-27 23:41:22+00:00,0,Forse Nino sta smettendo di fare l’ignavo? 😂  Gfvip  donnalisi,#Gfvip#donnalisi,4,0.4404,
1597012737007456256,maqualdietaa,2022-11-27 23:41:22+00:00,61,QUESTO FOTTUTISSIMO CONCETTO donnalisi  GFvip ,#donnalisi#GFvip,3,0.0,
1597012707425005568,gallosilvana18,2022-11-27 23:41:15+00:00,51,"Quanto si vede che Nikita, Micol, Edoardo Tavassi e Luca Onestini lo fanno sentire a proprio agio George, è così bello vederlo sorridere...🤍  gfvip  nikiters  incorvassi",#gfvip#nikiters#incorvassi,3,0.0,Nikita;Edoardo;Edoardo;Luca;Luca;George
1597012705134915585,MDaje7,2022-11-27 23:41:14+00:00,4,Antonino su Nikita “ la natura viene fuori questo lato maligno “ lui parla 24/24 di Nikita . Perfavore qualcuno lo fermi perchè ha rotto le palle   gfvip  incorvassi,#gfvip#incorvassi,4,0.34,Antonino;Nikita
1597012702953582593,MariannaTorto11,2022-11-27 23:41:14+00:00,1,Antonino perché non le dici in faccia a Luca queste cose adesso che lo hai davanti ? Ah ti caghi addosso 🤪 sai solo sparlare alle spalle un senza palle sei  gfvip  incorvassi  nikiters,#gfvip#incorvassi#nikiters,3,0.0,Antonino;Luca;Luca
1597012675443113984,gallosilvana18,2022-11-27 23:41:07+00:00,38,"Micol, Tavassi, Onestini, Nikita e George ridendo insieme all cortiletto. Chiaramente i mei favoriti. &lt;3  gfvip  incorvassi ",#gfvip#incorvassi,3,0.0,Nikita;George
1597012671517245440,04pCristina,2022-11-27 23:41:06+00:00,0,antoninooooo!!!! bingo!!! stavolta non ne ha sbagliata una  gfvip  nikiters,#gfvip#nikiters,5,0.5526,
1597012660494958592,anna12457384,2022-11-27 23:41:03+00:00,0,Eh ma Giaele è una banderuola!1!1!1 non vuole bene a nessuno e non difende mai Nikita  gfvip  gioiellers  nikiters  incorvassi ,#gfvip#gioiellers#nikiters#incorvassi,3,0.0,Giaele;Nikita
1597012644309135360,Giulia86427765,2022-11-27 23:41:00+00:00,0,REGIAAAAA CORTILETTO! CAZZOOOOO  GFVIP  incorvassi,#GFVIP#incorvassi,3,0.0,
1597012618765832192,2ghostshearts,2022-11-27 23:40:54+00:00,0,CORTILETTOOOOO  incorvassi   gfvip,#incorvassi#gfvip,3,0.0,
1597012608636588032,AnelloVincenza,2022-11-27 23:40:51+00:00,123,CLIZIA SOTTOLINEA che le uniche 2 donne a supportare micol sono state Giaele e nikita  gfvip   nikiters  incorvassi ,#gfvip#nikiters#incorvassi,3,0.0,Giaele
1597012594833125376,dussii111,2022-11-27 23:40:48+00:00,3," GFvip  incorvassi Ma antonino sta dicendo che Onestini si è attaccato a Nikita e George  (essendo ambiguo con nikita) per le preferenze del pubblico , che è il pensiero di mezzo twitter e viene attaccato💀",#GFvip#incorvassi,3,0.0,Antonino;Nikita;George
1597012573484089346,Saramarasaa,2022-11-27 23:40:43+00:00,30,Ma spina che alle 00.32 sta parlando male di Nikita con Giaele Daniele e ciarly.Sempre con la stessa storia che Nikita è falsa che è una giocatrice che nn sbaglia mai nel giocoVOTIAMO NIKITA RAGA DEVE ESSERE LA PREFERITA  gfvip  nikiters,#gfvip#nikiters,3,0.0,Nikita;Daniele;Giaele
1597012551900233728,Duazfan,2022-11-27 23:40:38+00:00,1,Le sicurezze della vita sono poche....Una di queste è l'ossessione di Antonino verso Nikita  Gfvip  nikiters,#Gfvip#nikiters,3,0.0,Antonino;Nikita
1597012525463527425,Duazfan,2022-11-27 23:40:31+00:00,2,Amici di spagna salvate nikita ..deve rosicare il obsesionato ..vamos  votate votate   nikiters   oriana  ciupilan   gfvip,#nikiters#oriana#ciupilan#gfvip,3,0.0,
1597012509441298434,CiulyL,2022-11-27 23:40:27+00:00,15,"Cioè Spinacino dice che Onestini usa strategiaaaaaIl diavolo è nella testa di chi pensa  gfvip  lukita  nikiters Onestini è buono a differenza di Antonino, basta ricordarsi di Tonon",#gfvip#lukita#nikiters,3,0.0,Antonino
1597012506253627392,Pao00048690,2022-11-27 23:40:27+00:00,61,QUESTO FOTTUTISSIMO CONCETTO donnalisi  GFvip ,#donnalisi#GFvip,3,0.0,
1597012495809798144,Suffo89,2022-11-27 23:40:24+00:00,1,ORA SONO SOLI E NON CE LI FAN VEDEREEEE!!!!!!  incorvassi  gfvip,#incorvassi#gfvip,5,0.6371,
1597012471755472902,Claudio06893830,2022-11-27 23:40:18+00:00,0,Pazzesco pure spianbele come tontonella arriva Luca e george e cambia discorso 🤡🤡🤡🤡🤡🤡🤡 sietr fatti per stare insieme voi due   gfvip  ciupilan  nikiters,#gfvip#ciupilan#nikiters,3,0.0,Luca;Luca;George
1597012462695776258,meandmilli,2022-11-27 23:40:16+00:00,1,Regiaaaaaa CORTILETTO   Gfvip  incorvassi,#Gfvip#incorvassi,3,0.0,
1597012451190394881,Micol_2893,2022-11-27 23:40:14+00:00,31,Luca: Ma la smetti di guardare lui?Anto: Io lo guardo sempre. Volevo vedere se stava Soraya se non stavi sempre a guardare lei..🤏🏻♥️ Donnalisi  GFVIP ,#Donnalisi#GFVIP,5,0.6369,Luca;Luca
1597012421558034432,Duazfan,2022-11-27 23:40:07+00:00,2,antonino sei in lop maaaaaaaaanbasta parlare di Nikitaaa  nikiters  gfvip,#nikiters#gfvip,3,0.0,Antonino;Nikita
1597012417996681216,giovy_maio,2022-11-27 23:40:06+00:00,6,Giaele che chiama Micol per fare i piatti..EdoTavassi: “non andare”🥹  gfvip  incorvassi ,#gfvip#incorvassi,3,0.0,Micol
1597012402964664320,FedericaInnoce9,2022-11-27 23:40:02+00:00,0, incorvassiL'importante Regia e' che ci fate vedere  Tavassi e  Micol  quando saranno soli  gfvip,#incorvassiL'importante#gfvip,3,0.0,
1597012368927576066,lasciamistareva,2022-11-27 23:39:54+00:00,0,Passano gli anni ma la regia di meeerda resta sempre quella incredibile oh  GFVIP   incorvassi,#GFVIP#incorvassi,3,0.0,
1597012363848208384,Eleonor19629519,2022-11-27 23:39:53+00:00,0, Antonino sei un cog*lione .  gfvip,#Antonino#gfvip,3,0.0,Antonino
1597012348887519233,gicarestik2,2022-11-27 23:39:49+00:00,1,Antonino perché non le dici in faccia a Luca queste cose adesso che lo hai davanti ? Ah ti caghi addosso 🤪 sai solo sparlare alle spalle un senza palle sei  gfvip  incorvassi  nikiters,#gfvip#incorvassi#nikiters,3,0.0,Antonino;Luca;Luca
1597012344562802689,anninaa00,2022-11-27 23:39:48+00:00,30,Ma spina che alle 00.32 sta parlando male di Nikita con Giaele Daniele e ciarly.Sempre con la stessa storia che Nikita è falsa che è una giocatrice che nn sbaglia mai nel giocoVOTIAMO NIKITA RAGA DEVE ESSERE LA PREFERITA  gfvip  nikiters,#gfvip#nikiters,3,0.0,Nikita;Daniele;Giaele
1597012275793362944,tvaddicted_ita,2022-11-27 23:39:32+00:00,17,SONO COSÌ BELLI  GFvip  incorvassi ,#GFvip#incorvassi,3,0.0,
1597012254972575744,Paola6629523489,2022-11-27 23:39:27+00:00,4,"🚨 ORIANA SI STA GIÀ PREPARANDO PER DOMANI,STA PROGETTANDO COSA DIRE,PRIMA CON SARA HA DETTO "" SE FANNO VEDERE LA SCENA DEL VAN (SCOPATA)...IO DIRÒ OVVIAMENTE CHE ERO UBRIACA,LUI NO...."" 🤢🤢🚨  gfvip incorvassi gintonic donnalisi nikiters",#gfvip#incorvassi#gintonic#donnalisi#nikiters,4,0.4824,Oriana
1597012249217941504,Duazfan,2022-11-27 23:39:25+00:00,1,Spinacino sta parlando di Onestini che ha la strategia con George e nikita  nikiters  lukita  gfvip,#nikiters#lukita#gfvip,4,0.34,George
1597012227050991616,martina20047130,2022-11-27 23:39:20+00:00,0,L'ho sapete perché Oriana e Micol non hanno legato? Perché Antonella e giaele hanno sempre remato contro. Purtroppo nn siete pronti a. Questo discorso ma è la pura verità  incorvassi. Invece di dire ho sonno ammetti che vuoi stare con spinacino  gfvip,#incorvassi.#gfvip,2,-0.4588,Oriana;Micol;Antonella
1597012214317461506,paolo_caciolli,2022-11-27 23:39:17+00:00,1,Ma quanto è buffa? ❤️ oriana  GFvip ,#oriana#GFvip,3,0.0,
1597012190430724099,Paola6629523489,2022-11-27 23:39:11+00:00,10,"🚨🚨 CONFERMATO LA FONTE DI 2 GIORNI FA🚨✅DOMANI IN PUNTATA CLIP IN PREPARAZIONE  ""LA CASA(ALCUNI) VS NIKITA"" gfvip gintonic incorvassi nikiters  donnalisi",#gfvip#gintonic#incorvassi#nikiters#donnalisi,3,0.0,
1597012189231337472,Duazfan,2022-11-27 23:39:11+00:00,30,Ma spina che alle 00.32 sta parlando male di Nikita con Giaele Daniele e ciarly.Sempre con la stessa storia che Nikita è falsa che è una giocatrice che nn sbaglia mai nel giocoVOTIAMO NIKITA RAGA DEVE ESSERE LA PREFERITA  gfvip  nikiters,#gfvip#nikiters,3,0.0,Nikita;Daniele;Giaele
1597012151306100736,CMangialomini,2022-11-27 23:39:02+00:00,2,antonino sei in lop maaaaaaaaanbasta parlare di Nikitaaa  nikiters  gfvip,#nikiters#gfvip,3,0.0,Antonino;Nikita
1597012142917832705,Francy11412804,2022-11-27 23:39:00+00:00,51,"Quanto si vede che Nikita, Micol, Edoardo Tavassi e Luca Onestini lo fanno sentire a proprio agio George, è così bello vederlo sorridere...🤍  gfvip  nikiters  incorvassi",#gfvip#nikiters#incorvassi,3,0.0,Nikita;Edoardo;Edoardo;Luca;Luca;George
1597012129541812225,VALE70942077,2022-11-27 23:38:57+00:00,30,Ma spina che alle 00.32 sta parlando male di Nikita con Giaele Daniele e ciarly.Sempre con la stessa storia che Nikita è falsa che è una giocatrice che nn sbaglia mai nel giocoVOTIAMO NIKITA RAGA DEVE ESSERE LA PREFERITA  gfvip  nikiters,#gfvip#nikiters,3,0.0,Nikita;Daniele;Giaele
1597012126430031872,Giusina1016,2022-11-27 23:38:56+00:00,8,"Patrizia su Micol “ non fa nulla per farsi conoscere , e fa battute a persone che non dovrebbe farle “ MA SONO SERIE QUESTE ??? ANCORA CHE HANNO IL CORAGGIO DI DIRE STE CAZZATE DOPO QUELLO CHE HANNO DETTO ???   gfvip  incorvassi ",#gfvip#incorvassi,1,-0.6901,Micol;Patrizia
1597012080309153792,Linkem25,2022-11-27 23:38:45+00:00,0,"Prima  Antonino lo trovavo belloccio, ora mi è talmente antipatico che lo trovo pure bruttarello. È gretto, vigliacco e subdolo. GFvip",#Antonino#GFvip,3,0.0,Antonino
1597012060747206657,AnelloVincenza,2022-11-27 23:38:40+00:00,68,"Nikita:“A me piacerebbe un sacco che la gente venisse in faccia a dirmelo ‘guarda che non mi sei piaciuta qui’, ma sai che non la sento mai sta cosa, solo George lo fa con me”Nikita urlalo 👏🔥 gfvip  nikiters  incorvassi",#gfvip#nikiters#incorvassi,2,-0.34,Nikita;George
1597012056485810180,Merycat16,2022-11-27 23:38:39+00:00,2,Amici di spagna salvate nikita ..deve rosicare il obsesionato ..vamos  votate votate   nikiters   oriana  ciupilan   gfvip,#nikiters#oriana#ciupilan#gfvip,3,0.0,
1597012053348470784,Valepad85,2022-11-27 23:38:39+00:00,7,"l’incoerenza su questo social é sempre più imbarazzante. avete fatto un casino per oriana che dice che micol ha i capelli sporchi ma a nessuno frega niente di nikita che dice su antonella “svacca e poi piange”, anzi avete pure il coraggio di difenderla🥶  donnalisi  gfvip",#donnalisi#gfvip,4,0.34,
1597012043739320323,polemica__,2022-11-27 23:38:36+00:00,23,"""George non parla mai, sta sempre zitto  non si diverte.""Ma colleghiamoci con Antonella in questo momento. gfvip  incorvassi ",#gfvip#incorvassi,3,0.0,George;Antonella
1597012042636210176,InsanityAngel1,2022-11-27 23:38:36+00:00,1,Le sicurezze della vita sono poche....Una di queste è l'ossessione di Antonino verso Nikita  Gfvip  nikiters,#Gfvip#nikiters,3,0.0,Antonino;Nikita
1597012024508436480,MDaje7,2022-11-27 23:38:32+00:00,2,Antonino ha due ossessioni adesso Nikita e Oriana quando finisce di sparlare di una sparla dell’altra   gfvip  oriana  nikiters,#gfvip#oriana#nikiters,4,0.34,Antonino;Nikita;Oriana
1597011991956029440,AllCrazyy04,2022-11-27 23:38:24+00:00,1,"Antonino sta sparlando di nikita … strano 🤦🏻‍♀️ Curatelo ve prego, ha un’ossessione patologica  gfvip  nikiters",#gfvip#nikiters,4,0.34,Antonino
1597011990983376896,teamsoleilsorge,2022-11-27 23:38:24+00:00,21,"sfottono Nikita che sente l'energia delle rocceTavassi a Luca ""capito?Se ti metti con lei torni a casa la trovi a letto co na roccia""Luca ""attilio tu cosa dici?"" ""ti sei mai trombato una roccia?""Attilio ""no in genere io me so fatto male"" 🙈  gfvip  nikiters  incorvassi ",#gfvip#nikiters#incorvassi,3,0.0,Nikita;Luca;Luca;Attilio
1597011961924894721,Saramarasaa,2022-11-27 23:38:17+00:00,1,Ma regia avete ripreso due che 🧹 e avete paura che ci scandalizziamo per due discorsi volgari??? Mettete il CORTILETTOOOO veloc  gfvip  incorvassi,#gfvip#incorvassi,3,0.0,
1597011955956387840,anomis98,2022-11-27 23:38:16+00:00,0,VOGLIAMO CAMBIARE REGIA??   gfvip  incorvassi ,#gfvip#incorvassi,3,0.0,
1597011955935375361,erikusruls,2022-11-27 23:38:15+00:00,1, REGIA IL CORTILETTOOOOOOOOOOOOOOOOOO gfvip incorvassi  incorvassi,#gfvip#incorvassi#incorvassi,3,0.0,
1597011949388460032,Giulia86427765,2022-11-27 23:38:14+00:00,0,Censurare discorsi sul sesso dopo la mezzanotte in cortiletto e non aver censurato le cattiverie dette alla luce del giorno da Wilma e Patrizia 🤡🤡🤡 circo  incorvassi  gfvip,#incorvassi#gfvip,3,0.0,Wilma;Patrizia
1597011889698971648,misterooforyou,2022-11-27 23:38:00+00:00,0,Loro per sempre la mia casa ❤️‍🩹  nikiters  gfvip ,#nikiters#gfvip,2,-0.296,
1597011878194343938,Argutamente,2022-11-27 23:37:57+00:00,4,La regia che nel cortiletto ha due ship ma decide di riprendere sara sul lettoMA COME RAGIONANO QUESTI gfvip  incorvassi ,#gfvip#incorvassi,4,0.34,
1597011870137077761,m4rybu,2022-11-27 23:37:55+00:00,1, REGIA IL CORTILETTOOOOOOOOOOOOOOOOOO gfvip incorvassi  incorvassi,#gfvip#incorvassi#incorvassi,3,0.0,
1597011846619623424,BerAliona,2022-11-27 23:37:49+00:00,22,NIKITA:Sempre corretta e lucida.Semplice e genuina.Non ha bisogno di screditare nessuno per apparire. Ha il coraggio di dire alle persone le cose in faccia. Non urla contro la gente che la deride.VOTATEE!!🔥🔥        LucaOneGFVip  lukita  nikiters  gfvip  ciupita  ciupilan ,#LucaOneGFVip#lukita#nikiters#gfvip#ciupita#ciupilan,1,-0.555,
1597011813392351234,Lisahahahahah,2022-11-27 23:37:42+00:00,0,Regia senti se sono discorsi troppo volgari togli l'audio e noi guardiamo e basta dai  incorvassi  gfvip,#incorvassi#gfvip,3,0.0,
1597011785558917121,tvaddicted_ita,2022-11-27 23:37:35+00:00,21,Loro non possono farne a meno  incorvassi  gfvip ,#incorvassi#gfvip,3,0.0,
1597011784862355459,Suffo89,2022-11-27 23:37:35+00:00,1,MA SE DOVETE CEBSURARLI CHIANATELI IN CONFESSIONALE E DITEGLI DI CAMVIARE DISCORSO!!!!!Non fateci stare una notte a sperare di ribeccare il cortiletto nella regia.  incorvassi  gfvip,#incorvassi#gfvip,3,0.0,
1597011749726609408,Alessio14386582,2022-11-27 23:37:26+00:00,0,Questo discorso di Antonino su onestini è molto interessante. Ascoltate  nikiters  gfvip  Gintonic,#nikiters#gfvip#Gintonic,3,0.0,Antonino
1597011720689840128,BarbaraColosimo,2022-11-27 23:37:19+00:00,3, gfvip  incorvassi Cortiletto Squad (Pt.21)MA ALLORA SIETE INFAMI ,#gfvip#incorvassi,3,0.0,
1597011671070871552,Lisahahahahah,2022-11-27 23:37:08+00:00,0,Un corridoio davvero???  incorvassi  gfvip,#incorvassi#gfvip,3,0.0,
1597011669955534849,CiulyL,2022-11-27 23:37:07+00:00,1,Spinacino sta parlando di Onestini che ha la strategia con George e nikita  nikiters  lukita  gfvip,#nikiters#lukita#gfvip,4,0.34,George
1597011656240168960,Francy11412804,2022-11-27 23:37:04+00:00,1,"Antonino sta sparlando di nikita … strano 🤦🏻‍♀️ Curatelo ve prego, ha un’ossessione patologica  gfvip  nikiters",#gfvip#nikiters,4,0.34,Antonino
1597011649457627136,imma96durazzo,2022-11-27 23:37:02+00:00,1," donnalisi il trio anto edo luca è wlcs di meraviglioso, SA di casa di semplicità...di vita vera. Xkè di vede la realtà del loto rapporto senza doppi fini, dinamiche e cose che riguardano il gioco. Sn vita vera ed è facile immaginare anche soraia cn loro.... gfvip",#donnalisi#gfvip,3,0.0,Luca;Luca
1597011645259083776,Valepad85,2022-11-27 23:37:01+00:00,31,Luca: Ma la smetti di guardare lui?Anto: Io lo guardo sempre. Volevo vedere se stava Soraya se non stavi sempre a guardare lei..🤏🏻♥️ Donnalisi  GFVIP ,#Donnalisi#GFVIP,5,0.6369,Luca;Luca
1597011640850952192,Suffo89,2022-11-27 23:37:00+00:00,1,MA SE DOVETE CEBSURARLI CHIANATELI IN CONFESSIONALE E DITEGLI DI CAMVIARE DISCORSO!!!!!Non fateci stare una notte a sperare di ribeccare il cortiletto nella regia.  incorvassi  gfvip,#incorvassi#gfvip,3,0.0,
1597011638435336192,nic_sc19,2022-11-27 23:37:00+00:00,1,Ma regia avete ripreso due che 🧹 e avete paura che ci scandalizziamo per due discorsi volgari??? Mettete il CORTILETTOOOO veloc  gfvip  incorvassi,#gfvip#incorvassi,3,0.0,
1597011587339980800,lillicat10,2022-11-27 23:36:48+00:00,22,NIKITA:Sempre corretta e lucida.Semplice e genuina.Non ha bisogno di screditare nessuno per apparire. Ha il coraggio di dire alle persone le cose in faccia. Non urla contro la gente che la deride.VOTATEE!!🔥🔥        LucaOneGFVip  lukita  nikiters  gfvip  ciupita  ciupilan ,#LucaOneGFVip#lukita#nikiters#gfvip#ciupita#ciupilan,1,-0.555,
1597011568197177345,StraTalk87,2022-11-27 23:36:43+00:00,0,Mi pare chiaro che  Antonino prima di Natale abbandonerà. GFvip,#Antonino#GFvip,3,0.0,Antonino
1597011484420485120,mymindtravels_,2022-11-27 23:36:23+00:00,8, gfvipQuesta è la posizione giusta donnacritici non inversa 💀  nikiters  incorvassi  lukita ,#gfvipQuesta#nikiters#incorvassi#lukita,3,0.0,
1597011451776225280,giovy_maio,2022-11-27 23:36:15+00:00,12,a me fa ridere perché è vero💀 GFvip  incorvassi ,#GFvip#incorvassi,3,0.0,
1597011441092947968,Kiara851794004,2022-11-27 23:36:13+00:00,0,Guarda che è lui che in questi giorni sta attaccato al culo di antonella anche prima in veranda 🤣 gfvip  donnalisi ,#gfvip#donnalisi,4,0.4939,
1597011356603277312,FedericaMassa19,2022-11-27 23:35:53+00:00,61,QUESTO FOTTUTISSIMO CONCETTO donnalisi  GFvip ,#donnalisi#GFvip,3,0.0,
1597011339670872064,justdonnalisi,2022-11-27 23:35:49+00:00,31,Luca: Ma la smetti di guardare lui?Anto: Io lo guardo sempre. Volevo vedere se stava Soraya se non stavi sempre a guardare lei..🤏🏻♥️ Donnalisi  GFVIP ,#Donnalisi#GFVIP,5,0.6369,Luca;Luca
1597011337783099392,RosiNjuma,2022-11-27 23:35:48+00:00,3,"la differenza che Nikita parla all’orecchio, mentre Antonella parla a voce alta !  GFVIP  donnalisi",#GFVIP#donnalisi,3,0.0,Nikita;Antonella
1597011329239306240,GIOVANNI___1979,2022-11-27 23:35:46+00:00,4,Antonino su Nikita “ la natura viene fuori questo lato maligno “ lui parla 24/24 di Nikita . Perfavore qualcuno lo fermi perchè ha rotto le palle   gfvip  incorvassi,#gfvip#incorvassi,4,0.34,Antonino;Nikita
1597011298390519810,BerAliona,2022-11-27 23:35:39+00:00,4,Antonino su Nikita “ la natura viene fuori questo lato maligno “ lui parla 24/24 di Nikita . Perfavore qualcuno lo fermi perchè ha rotto le palle   gfvip  incorvassi,#gfvip#incorvassi,4,0.34,Antonino;Nikita
1597011221630578688,gaiacolognesi,2022-11-27 23:35:20+00:00,0,scusatemi ma per me è una bella leccaculo prima della puntata perchè fino a ieri sparlava di tutti  gfvip  nikiters  incorvassi ,#gfvip#nikiters#incorvassi,3,0.0,
1597011155549327361,RoyalGossip2,2022-11-27 23:35:05+00:00,0,Ci mancavano queste due che manco si capiscono tra loro quando parlano 🤦🏽‍♀️🤦🏽‍♀️🤦🏽‍♀️  gfvip   incorvassi,#gfvip#incorvassi,3,0.0,
1597011140684681216,nastoli1,2022-11-27 23:35:01+00:00,2,Antonino ha due ossessioni adesso Nikita e Oriana quando finisce di sparlare di una sparla dell’altra   gfvip  oriana  nikiters,#gfvip#oriana#nikiters,4,0.34,Antonino;Nikita;Oriana
1597011061751717889,Lara89__,2022-11-27 23:34:42+00:00,0,Quanto vorrei che ad Edo venga fatto vedere quel video di casachi di Clizia che giudica il suo rapporto con Antonella. Quella sì che sarebbe una dinamica gfvip  donnalisi,#gfvip#donnalisi,3,0.0,
1597011059616776192,Varya1910,2022-11-27 23:34:42+00:00,17,SONO COSÌ BELLI  GFvip  incorvassi ,#GFvip#incorvassi,3,0.0,
1597011036573691905,Serra1970Sofia,2022-11-27 23:34:36+00:00,26,Nikita fa un discorso dove dice che Antonella non si vede in forma ma che ha un fisico stupendo e le donnalisi lo rigirano dicendo che l'ha giudicata sul suo corpo. Fate schifo.  gfvip  nikiters  incorvassi,#gfvip#nikiters#incorvassi,4,0.34,Nikita;Antonella
