Id,Screen_name,Created_at,Retweet,Text,Hashtags,Sentiment,Compound,Ents
1598091645102309376,Gina35415084,2022-11-30 23:08:33+00:00,18,la dolcezza di questo momento 🫠 gfvip  donnalisi ,#gfvip#donnalisi,3,0.0,
1598091627574497284,Neise_love,2022-11-30 23:08:29+00:00,43,"COMUNQUE BISOGNA RINGRAZIARE TAVASSI, ONESTINI E LUCIANO PER AVER RESO QUESTA CASA PIÙ DIVERTENTE gfvip  incorvassi ",#gfvip#incorvassi,3,0.0,Luciano
1598091619554988043,ycnarf0305,2022-11-30 23:08:27+00:00,10,LA POTENZA❤️‍🔥 donnalisi  gfvip ,#donnalisi#gfvip,2,-0.34,
1598091581508456454,FalcioneRosa,2022-11-30 23:08:18+00:00,1,"Stasera hanno dato ulteriore conferma che in questo amore non c'e nulla di studiato, di forzato, di costruito, è amore, amore vero al 100%. È nato spontaneamente nella maniera piu naturale tra alti e bassi ma sta crescendo sempre di piu  donnalisi  GFvip",#donnalisi#GFvip,3,0.0,
1598091578324979723,Frances83943790,2022-11-30 23:08:18+00:00,27,"Nikita chiede consigli a Micol perchè è la prima volta in questa situazione e lei spiega con calma, sto adorando, belle 🫶  gfvip  nikiters  incorvassi ",#gfvip#nikiters#incorvassi,3,0.0,Nikita;Micol
1598091574239727616,sureality1,2022-11-30 23:08:17+00:00,0,"Pensate a quante cose hanno visto fuori ""i positivi"". Alberto è entrato che sa un sacco di cose  gfvip  donnalisi ",#gfvip#donnalisi,3,0.0,
1598091570095755272,Frances94786841,2022-11-30 23:08:16+00:00,0,Oriana però …lunedì questo ti ha trattato peggio di una merda Ma come fai a parlarci ?  donnalisi  gfvip,#donnalisi#gfvip,4,0.34,Oriana
1598091465645002753,Paola7319,2022-11-30 23:07:51+00:00,27,"Nikita chiede consigli a Micol perchè è la prima volta in questa situazione e lei spiega con calma, sto adorando, belle 🫶  gfvip  nikiters  incorvassi ",#gfvip#nikiters#incorvassi,3,0.0,Nikita;Micol
1598091449085890562,Lunapallida5,2022-11-30 23:07:47+00:00,1,SONO PROPRIO ANDATI STO MALE  gfvip  incorvassi,#gfvip#incorvassi,3,0.0,
1598091438906314756,Frances83943790,2022-11-30 23:07:44+00:00,69,"Antonella a cena con Edo: ""In questo posto PRIVATO""NOI: Donnalisi  GFvip ",#Donnalisi#GFvip,3,0.0,
1598091408434696200,soloxilgf,2022-11-30 23:07:37+00:00,53,"Tavassi e Onestini insieme mi fanno spaccare,rianimano letteralmente quella casa  gfvip   incorvassi ",#gfvip#incorvassi,3,0.0,
1598091406899580935,Lunapallida5,2022-11-30 23:07:37+00:00,2,Giaele con Onestini e molto divertente. Non la visto ridere cosi allá miliardaria con Antonino in la vita.  gfvip  incorvassi,#gfvip#incorvassi,3,0.0,Giaele;Antonino
1598091405926322177,Gina35415084,2022-11-30 23:07:36+00:00,229,"Tavassi: -“Batti le mani schiocca le dita abbasso Antonella, viva Nikita!!”URLALOOOOO gfvip  nikiters  incorvassi ",#gfvip#nikiters#incorvassi,3,0.0,
1598091399521763329,Methamorphose30,2022-11-30 23:07:35+00:00,45,Le parole di Luca ❤ un cuore buono che si è prodigato per questi ragazzi. Grazie salatino le anime belle come le tue sono rare.  gfvip  donnalisi ,#gfvip#donnalisi,5,0.6369,Luca;Luca
1598091389090553856,vanerusso01,2022-11-30 23:07:32+00:00,18,la dolcezza di questo momento 🫠 gfvip  donnalisi ,#gfvip#donnalisi,3,0.0,
1598091371209891840,justdonnalisi,2022-11-30 23:07:28+00:00,12,"Nella vita un uomo che ti guarda così, non vogliamo altro. ❤️ donnalisi  gfvip ",#donnalisi#gfvip,3,0.0,
1598091351740289026,Ginni2018,2022-11-30 23:07:24+00:00,69,"Antonella a cena con Edo: ""In questo posto PRIVATO""NOI: Donnalisi  GFvip ",#Donnalisi#GFvip,3,0.0,
1598091340851875840,MariannaTorto11,2022-11-30 23:07:21+00:00,5,"Cmq x nn fraintendere Nikita nn è gelosa di Oriana, le da fastidio il modo in cui One gioca con lei Visto che lei si deve sentire limitata con Daniele Luciano e Luca solo xché lui gli ha detto che le da fastidio alcuni atteggiamenti che ha con loro  gfvip  nikiters",#gfvip#nikiters,5,0.5859,Nikita;Oriana;Daniele;Luciano;Luca;Luca
1598091332954001412,_JUVale_,2022-11-30 23:07:19+00:00,41,"Nikita a Patrizia: -“Mi sei mancata quando non c’eri, si sentiva un sacco la tua assenza ma non parlo delle pulizie…tu dovresti pensare di più a te e fare delle cose per te” L'empatia è una di quelle tante qualità che più mi piace di Nikita...🤍 GFvip  nikiters  incorvassi ",#GFvip#nikiters#incorvassi,3,0.0,Patrizia;Nikita
1598091310443171853,justdonnalisi,2022-11-30 23:07:14+00:00,8,"GRAZIE LUCAS ,OLIO SU TELA  Donnalisi  Gfvip ",#Donnalisi#Gfvip,3,0.0,Luca;Luca
1598091302276861963,chiaratommysupp,2022-11-30 23:07:12+00:00,18,la dolcezza di questo momento 🫠 gfvip  donnalisi ,#gfvip#donnalisi,3,0.0,
1598091285252182017,Brenda_C__,2022-11-30 23:07:08+00:00,18,la dolcezza di questo momento 🫠 gfvip  donnalisi ,#gfvip#donnalisi,3,0.0,
1598091258609963011,sonosfasata,2022-11-30 23:07:01+00:00,1,SONO PROPRIO ANDATI STO MALE  gfvip  incorvassi,#gfvip#incorvassi,3,0.0,
1598091245116887046,MangelaVilo,2022-11-30 23:06:58+00:00,0," Ma Nikita è un po' gelosa di Oriana, non di Giaele. Oltretutto Giaele è sposata e Onestini è un tipo tradizionale, è poco credibile che cerchi una relazione con Giaele. Fa casino e basta, come con Sarah  gfvip  nikiters",#gfvip#nikiters,3,0.0,Nikita;Giaele;Sarah
1598091239467159561,pallanteceleste,2022-11-30 23:06:57+00:00,18,la dolcezza di questo momento 🫠 gfvip  donnalisi ,#gfvip#donnalisi,3,0.0,
1598091212828704768,liekemart,2022-11-30 23:06:50+00:00,2,Giaele con Onestini e molto divertente. Non la visto ridere cosi allá miliardaria con Antonino in la vita.  gfvip  incorvassi,#gfvip#incorvassi,3,0.0,Giaele;Antonino
1598091208425115660,justdonnalisi,2022-11-30 23:06:49+00:00,18,la dolcezza di questo momento 🫠 gfvip  donnalisi ,#gfvip#donnalisi,3,0.0,
1598091149427691520,loryc9529,2022-11-30 23:06:35+00:00,17," Gfvip  Incorvassi  gintonic Edoardo ""Quanta gente avrebbe stuprato Oriana? Tanta ce ne sono"" Ma che frase è, e cosa c'entra in quella situazione 🥶🥶 ",#Gfvip#Incorvassi#gintonic,3,0.0,Edoardo;Edoardo
1598091143400820736,CRUDELlA__,2022-11-30 23:06:34+00:00,18,la dolcezza di questo momento 🫠 gfvip  donnalisi ,#gfvip#donnalisi,3,0.0,
1598091114581757952,paolo_caciolli,2022-11-30 23:06:27+00:00,0,Non va bene! oriana  GFvip ,#oriana#GFvip,3,0.0,
1598091073821511682,stay_resilient,2022-11-30 23:06:17+00:00,71,Nikita: -“Antonino stai ascoltando quello che ti sto dicendo o vuoi semplicemente andarmi contro?”NIKITAAAAAAAA 🏹 gfvip  nikiters  incorvassi ,#gfvip#nikiters#incorvassi,3,0.0,Nikita
1598091071023910920,Lisahahahahah,2022-11-30 23:06:17+00:00,0,Vi prego ricominciate io sono pronta  gfvip  incorvassi ,#gfvip#incorvassi,3,0.0,
1598091058126426112,youareporacci,2022-11-30 23:06:14+00:00,21,"È un gioco e come tale va preso ma, mi chiedo, perché questo accanimento verso un concorrente?Lo hanno deriso dopo che si era aperto faticosamente.Non ha mai visto un suo familiare.Viene continuamente criticato per la relazione. Ma perché?Mi dispiace, Edo❤️ gfvip  donnalisi ",#gfvip#donnalisi,4,0.4137,
1598091055400128513,frency15021990,2022-11-30 23:06:13+00:00,64,"""Tu mi sottovaluti""Antonellina hai vinto tutto stasera ♥️ Donnalisi  GFVIP ",#Donnalisi#GFVIP,5,0.6369,
1598091047590318080,MariannaTorto11,2022-11-30 23:06:11+00:00,1,"Comunque boh da come parla la gente mi sembra che nessuno abbia mai avuto una cotta. Non dico che non si faccia troppi problemi, se lo dice da sola, ma lasciatele vivere sta cosa in pace  nikita  nikiters  GFvip",#nikita#nikiters#GFvip,3,0.0,
1598091029298974720,Silvi0184,2022-11-30 23:06:07+00:00,13,Il discorso magistrale di edoardo che come sempre lucidissimo spiega ciò che è successo ieri sera e l atteggiamento assolutamente controproducente di Daniele  drojette   donnalisi   gfvip ,#drojette#donnalisi#gfvip,4,0.4588,Edoardo;Edoardo;Daniele
1598091007773806593,Mirellamayadado,2022-11-30 23:06:02+00:00,33,"Nikita:“Non parlo con Antonino, non mi parlano di Antonino, non parlo di Antonino, non vivo guardandolo notte e giorno, quindi io cosa ne so che lui usa il dolcificante per motivi di salute. Non l'ho mai saputa questa cosa”Questo concetto 👏🔥 gfvip  nikiters  incorvassi ",#gfvip#nikiters#incorvassi,2,-0.34,Antonino
1598090971996393477,Duazfan,2022-11-30 23:05:53+00:00,1," Nikita ha passato anni tra America e Cina a fare la modella, ha si comunque delle tare dovute al suo passato, ma quante volte ha sbagliato fin ora?  gfvip  nikiters",#gfvip#nikiters,5,0.7351,Nikita
1598090914056278017,itssmanueel,2022-11-30 23:05:39+00:00,71,Nikita: -“Antonino stai ascoltando quello che ti sto dicendo o vuoi semplicemente andarmi contro?”NIKITAAAAAAAA 🏹 gfvip  nikiters  incorvassi ,#gfvip#nikiters#incorvassi,3,0.0,Nikita
1598090904577150978,RatonzitaSpain,2022-11-30 23:05:37+00:00,1,Capolavoro di Bellezza.❤️❤️ oriana  GFvip ,#oriana#GFvip,3,0.0,
1598090884788424704,youareporacci,2022-11-30 23:05:32+00:00,45,Le parole di Luca ❤ un cuore buono che si è prodigato per questi ragazzi. Grazie salatino le anime belle come le tue sono rare.  gfvip  donnalisi ,#gfvip#donnalisi,5,0.6369,Luca;Luca
1598090873920983046,frency15021990,2022-11-30 23:05:30+00:00,41,Tutto mi aspettavo tranne vedere il polletto commosso 😭♥️ Donnalisi  GFVIP ,#Donnalisi#GFVIP,4,0.2732,
1598090863514914820,iamstrongx7,2022-11-30 23:05:27+00:00,0,"Daniele chiede ad Edoardo di giocare a poker, gli ha detto di sì ma domaniAntonella ha detto ad Edo che da quando hanno litigato Antonino non le ha rivolto più la parola, Edo le risponde che non gliene frega e preferisce parlare di altro gfvip  donnalisi",#gfvip#donnalisi,5,0.7351,Daniele;Edoardo;Edoardo;Antonino
1598090862881574916,youareporacci,2022-11-30 23:05:27+00:00,29,mi sono commossa.❤️‍🩹 gfvip  donnalisi ,#gfvip#donnalisi,3,0.0,
1598090843541639168,youareporacci,2022-11-30 23:05:22+00:00,15,Il più grande spettacolo dopo il Big bang...siete voi ❤️ donnalisi  drojette  gfvip ,#donnalisi#drojette#gfvip,3,0.0,
1598090830803537924,Sandy___8,2022-11-30 23:05:19+00:00,6,Quando capiranno lì dentro che Wilma è peggio di Patrizia??? incorvassi  gfvip ,#incorvassi#gfvip,3,0.0,Wilma;Patrizia
1598090823849381888,suarin1969,2022-11-30 23:05:18+00:00,3,Giaele e Sara mi spezzano vi giuro ⚰️⚰️  gfvip  incorvassi,#gfvip#incorvassi,3,0.0,Giaele
1598090814533832707,GIORGINODJ,2022-11-30 23:05:15+00:00,27,PER FAVORE QUESTO VIDEOOOOOLA FACCIA DELLA MILIARDARIA QUANDO CAPISCE DI ESSERSI VERSATA TUTTO ADDOSSO  GFVIP  incorvassi ,#GFVIP#incorvassi,3,0.0,
1598090814445752320,senzailbastone1,2022-11-30 23:05:15+00:00,0,"Ecco qui. Tutto studiato a tavolino e loro sono le pedine. Ma vengono pagati per questo, giustamente si devono prestare ai giochi  gfvip  nikiters  gintonic  donnalisi  gioiellers ",#gfvip#nikiters#gintonic#donnalisi#gioiellers,3,0.0,
1598090813170683910,ycnarf0305,2022-11-30 23:05:15+00:00,69,"Antonella a cena con Edo: ""In questo posto PRIVATO""NOI: Donnalisi  GFvip ",#Donnalisi#GFvip,3,0.0,
1598090805339918341,Skq7qZ,2022-11-30 23:05:13+00:00,5," Gfvip  Incorvassi Visto che nei commenti non capite il contesto; Parlavano di Soraya e Luca e che lei è fortunata, mentre tra lei e Daniele si imbuca Micol. La vecchietta non ce la fa a farcela💀 ",#Gfvip#Incorvassi,3,0.0,Luca;Luca;Daniele
1598090779935019010,ycnarf0305,2022-11-30 23:05:07+00:00,26,"Per tutti quelli che si chiedono la ragione per cui Edo si sia innamorato di lei, è tutto qui: Donnalisi  GFvip ",#Donnalisi#GFvip,3,0.0,
1598090709642678272,youareporacci,2022-11-30 23:04:50+00:00,48,"Non dimenticherò MAI la reazione di Edoardo, lui è proprio un uomo speciale, raro ❤️  donnalisi  GFvip  drojette ",#donnalisi#GFvip#drojette,3,0.0,Edoardo;Edoardo
1598090688792760320,Skq7qZ,2022-11-30 23:04:45+00:00,3,Giaele e Sara mi spezzano vi giuro ⚰️⚰️  gfvip  incorvassi,#gfvip#incorvassi,3,0.0,Giaele
1598090687031185413,edo_fanpage,2022-11-30 23:04:45+00:00,10,LA POTENZA❤️‍🔥 donnalisi  gfvip ,#donnalisi#gfvip,2,-0.34,
1598090685994803202,BerAliona,2022-11-30 23:04:45+00:00,3,Ma Micol deve svegliarsi su Wilma perché non è proprio più umana di Patrizia .  Gfvip  incorvassi  nikiters  ,#Gfvip#incorvassi#nikiters,3,0.0,Micol;Wilma;Patrizia
1598090625983090691,icarvsplume,2022-11-30 23:04:30+00:00,5,"Cmq x nn fraintendere Nikita nn è gelosa di Oriana, le da fastidio il modo in cui One gioca con lei Visto che lei si deve sentire limitata con Daniele Luciano e Luca solo xché lui gli ha detto che le da fastidio alcuni atteggiamenti che ha con loro  gfvip  nikiters",#gfvip#nikiters,5,0.5859,Nikita;Oriana;Daniele;Luciano;Luca;Luca
1598090623117950976,amati_89,2022-11-30 23:04:30+00:00,10,LA POTENZA❤️‍🔥 donnalisi  gfvip ,#donnalisi#gfvip,2,-0.34,
1598090622241771527,lucreziamazzeaa,2022-11-30 23:04:30+00:00,48, Gfvip  incorvassi Nonni ancora gelosa di Micol e Patrizia la affossa sto male ,#Gfvip#incorvassi,3,0.0,Micol;Patrizia
1598090557284585481,MarviVittoria,2022-11-30 23:04:14+00:00,0,Da quando Alberto le ha suggerito il triangolo Giaele si è lanciata   Nikita  gfvip,#Nikita#gfvip,4,0.34,Giaele;Nikita
1598090555904659462,frency15021990,2022-11-30 23:04:14+00:00,31,Ricapitolando - nessun familiare da due mesi - accanimento su lui e la coppia - deriso dagli autori sulla linea della vita … SONO VERAMENTE AMAREGGIATA PER LUI  Gfvip  Donnalisi ,#Gfvip#Donnalisi,3,0.0,
1598090536115933202,ully37834952,2022-11-30 23:04:09+00:00,1,onestini che gira la casa e fa il fenomeno con tutte mentre nikita sta a guardare sempre piu' tormentata    gfvip stavi meglio quando scherzavi con daniele e george  nikiters   denzzzers ,#gfvip#nikiters#denzzzers,3,0.0,Daniele;George
1598090534782144514,maialexbelli,2022-11-30 23:04:09+00:00,48, Gfvip  incorvassi Nonni ancora gelosa di Micol e Patrizia la affossa sto male ,#Gfvip#incorvassi,3,0.0,Micol;Patrizia
1598090490305744902,giovy_maio,2022-11-30 23:03:58+00:00,4,Porco d10 sono svenuto 🤭 nikiters  incorvassi  gfvip ,#nikiters#incorvassi#gfvip,4,0.4939,
1598090489601101833,AmorMicchi,2022-11-30 23:03:58+00:00,1,PER ME QUELLO CHE HANNO PRESO GIAELE E SARÀ GRAZIE⚰️  gfvip  incorvassi,#gfvip#incorvassi,3,0.0,
1598090487898214400,edo_fanpage,2022-11-30 23:03:58+00:00,3,Per me sono loro tre❤️  DONNALISI  GFvip ,#DONNALISI#GFvip,3,0.0,
1598090477383094273,itssmanueel,2022-11-30 23:03:55+00:00,28,"Nikita ad Antonella: “Mi dispiace magari aver usato un termine forte e su questo ti CHIEDO SCUSA, ma per me sei bella e ti vedo veramente fregna con quella tutina“ e le fa i complimenti.Questo chiarimento spero sia servito a qualcosa.  gfvip  nikiters  donnalisi ",#gfvip#nikiters#donnalisi,3,0.0,
1598090469803986944,lunablup,2022-11-30 23:03:53+00:00,48, Gfvip  incorvassi Nonni ancora gelosa di Micol e Patrizia la affossa sto male ,#Gfvip#incorvassi,3,0.0,Micol;Patrizia
1598090396806320132,MDaje7,2022-11-30 23:03:36+00:00,3,"Charlie di nuovo in mezzo alla bufera per le nuove frasi sessiste su Oriana, molte testate web lo stanno scrivendo! Questa volta Signorini non potrà far finta di nulla! gfvip  Oriana  orianistas",#gfvip#Oriana#orianistas,3,0.0,Charlie;Oriana
1598090392884326402,amati_89,2022-11-30 23:03:35+00:00,17,"Delle parole non possono farti piangereLe parole:“Nella vita parecchie volte ci facciamo prendere da paure e paranoie ed è quello che ci frega. Godetevi quello che vi state vivendo ora. Vivetevi e basta, per davvero! Ĺe paure non portano a niente"" donnalisi  gfvip ",#donnalisi#gfvip,3,0.0,
1598090392205168643,itssmanueel,2022-11-30 23:03:35+00:00,26,Nikita: “Cosa piace ad Alby che possiamo fargli?”Luca Onestini: “Facciamo una torta”Nikita: “Si facciamo una torta di ritorno”Vi prego lei è sempre così carina 🤍 gfvip  nikiters  thepisis  incorvassi ,#gfvip#nikiters#thepisis#incorvassi,3,0.0,
1598090390896545793,youareporacci,2022-11-30 23:03:34+00:00,6,"Daje Edoà, sei il PSG 💪🏻 Donnalisi  GFVIP  Drojette ",#Donnalisi#GFVIP#Drojette,3,0.0,
1598090372542271494,soloxilgf,2022-11-30 23:03:30+00:00,16,"“UNA BELLA CAMOMILLA CALDA”PUNZO sei tu il gf, sei tu  gfvip  incorvassi ",#gfvip#incorvassi,3,0.0,
1598090367932731393,edo_fanpage,2022-11-30 23:03:29+00:00,8,"GRAZIE LUCAS ,OLIO SU TELA  Donnalisi  Gfvip ",#Donnalisi#Gfvip,3,0.0,Luca;Luca
1598090360886300679,prest0nlogan,2022-11-30 23:03:27+00:00,48,"Non dimenticherò MAI la reazione di Edoardo, lui è proprio un uomo speciale, raro ❤️  donnalisi  GFvip  drojette ",#donnalisi#GFvip#drojette,3,0.0,Edoardo;Edoardo
1598090348525686789,bericomelius,2022-11-30 23:03:24+00:00,1," Nikita ha passato anni tra America e Cina a fare la modella, ha si comunque delle tare dovute al suo passato, ma quante volte ha sbagliato fin ora?  gfvip  nikiters",#gfvip#nikiters,5,0.7351,Nikita
1598090326845329415,itssmanueel,2022-11-30 23:03:19+00:00,77,GIUDICATE VOI QUESTA FOTO 😂  gfvip  nikiters ,#gfvip#nikiters,4,0.4404,
1598090321145270275,maqualdietaa,2022-11-30 23:03:18+00:00,26,"Per tutti quelli che si chiedono la ragione per cui Edo si sia innamorato di lei, è tutto qui: Donnalisi  GFvip ",#Donnalisi#GFvip,3,0.0,
1598090308902096898,MDaje7,2022-11-30 23:03:15+00:00,8,"“qualcuno ha dei problemi seri ?”☝🏻 si, io“qual è ?”non mangio i ceciIO NON RIESCO A SMETTERE DI PENSARCI  incorvassi  gfvip ",#incorvassi#gfvip,4,0.4137,
1598090302757441547,maqualdietaa,2022-11-30 23:03:13+00:00,51,"Edoardo: -“Prendermi dell'insicuro da una persona che a mia volta reputo un insicuro, perchè uno che passa le giornate a guardarsi allo specchio a mettersi le creme tutti i giorni...”EDOARDO ASFALTANDO IL BELENO, HO GODUTO TANTISSIMO 🔥 gfvip  nikiters  incorvassi  donnalisi ",#gfvip#nikiters#incorvassi#donnalisi,1,-0.5574,Edoardo;Edoardo
1598090280267583493,ESTANCA2,2022-11-30 23:03:08+00:00,1,PER ME QUELLO CHE HANNO PRESO GIAELE E SARÀ GRAZIE⚰️  gfvip  incorvassi,#gfvip#incorvassi,3,0.0,
1598090266766118918,TITTI72698701,2022-11-30 23:03:05+00:00,0," Gfvip  incorvassi A questa il vino fa proprio male,dovrebbe farsi curare ",#Gfvip#incorvassi,3,0.0,
1598090238718808070,Stormborn_90,2022-11-30 23:02:58+00:00,0,"Poche sono le certezze nella vita, una di queste è Daniele che chiede di fare gelati a chiunque 😂 Gfvip  incorvassi",#Gfvip#incorvassi,4,0.4404,Daniele
1598090235828932613,misscuore85,2022-11-30 23:02:57+00:00,5," Gfvip  Incorvassi Visto che nei commenti non capite il contesto; Parlavano di Soraya e Luca e che lei è fortunata, mentre tra lei e Daniele si imbuca Micol. La vecchietta non ce la fa a farcela💀 ",#Gfvip#Incorvassi,3,0.0,Luca;Luca;Daniele
1598090229310984197,fevdericolucia,2022-11-30 23:02:56+00:00,0,Mio Dio OnestOne mi uccide ahahahahah  GFvip  incorvassi,#GFvip#incorvassi,3,0.0,
1598090219651502089,maqualdietaa,2022-11-30 23:02:54+00:00,24,"Antonella Fiordelisi stasera ha detto 'amore mio te mollo col coso..ah si, col cazzo' ❤️ GFvip  donnalisi ",#GFvip#donnalisi,4,0.34,Antonella
1598090213989191688,amaremenonsipuo,2022-11-30 23:02:52+00:00,69,"Antonella a cena con Edo: ""In questo posto PRIVATO""NOI: Donnalisi  GFvip ",#Donnalisi#GFvip,3,0.0,
1598090189318295558,amati_89,2022-11-30 23:02:46+00:00,15,Il più grande spettacolo dopo il Big bang...siete voi ❤️ donnalisi  drojette  gfvip ,#donnalisi#drojette#gfvip,3,0.0,
1598090186038349830,itssmanueel,2022-11-30 23:02:46+00:00,65,"Nikita: “Io il fatto del dolcificante non lo sapevo, visto che io con Antonino non ci parlo e nessuno me lo ha detto”ADESSO CAPITE? gfvip  nikiters  incorvassi ",#gfvip#nikiters#incorvassi,4,0.34,Antonino
1598090170674614272,BrunaMarchett18,2022-11-30 23:02:42+00:00,222,FINALMENTE EDOARDO ! FINALMENTE ! 90 MINUTI DI APPLAUSI ! MOLLALA! gfvip  gfvip7  donnalisi  gintonic  nikiters  incorvassi ,#gfvip#gfvip7#donnalisi#gintonic#nikiters#incorvassi,3,0.0,
1598090162285981696,maqualdietaa,2022-11-30 23:02:40+00:00,41,Tutto mi aspettavo tranne vedere il polletto commosso 😭♥️ Donnalisi  GFVIP ,#Donnalisi#GFVIP,4,0.2732,
1598090159597457414,AmorMicchi,2022-11-30 23:02:39+00:00,3,Giaele e Sara mi spezzano vi giuro ⚰️⚰️  gfvip  incorvassi,#gfvip#incorvassi,3,0.0,Giaele
1598090145286492163,Verovera_01,2022-11-30 23:02:36+00:00,1,"Comunque boh da come parla la gente mi sembra che nessuno abbia mai avuto una cotta. Non dico che non si faccia troppi problemi, se lo dice da sola, ma lasciatele vivere sta cosa in pace  nikita  nikiters  GFvip",#nikita#nikiters#GFvip,3,0.0,
1598090133588578313,maqualdietaa,2022-11-30 23:02:33+00:00,18,NON IL GALATEO ASSOLUTAMENTE NON RISPETTATO VI PREGO STO PIANGENDO Donnalisi  GFVIP ,#Donnalisi#GFVIP,3,0.0,
1598090103003394048,Suffo89,2022-11-30 23:02:26+00:00,1,Onestini Sara e Giaele non han bevuto solo vino 🤔  incorvassi  GFvip,#incorvassi#GFvip,3,0.0,Giaele
1598090100063502337,Abbiamovintonoi,2022-11-30 23:02:25+00:00,69,"Antonella a cena con Edo: ""In questo posto PRIVATO""NOI: Donnalisi  GFvip ",#Donnalisi#GFvip,3,0.0,
1598090082556080128,dussii111,2022-11-30 23:02:21+00:00,5," Gfvip  Incorvassi Visto che nei commenti non capite il contesto; Parlavano di Soraya e Luca e che lei è fortunata, mentre tra lei e Daniele si imbuca Micol. La vecchietta non ce la fa a farcela💀 ",#Gfvip#Incorvassi,3,0.0,Luca;Luca;Daniele
1598090077103886342,Beluseries,2022-11-30 23:02:20+00:00,3,".Daniele con Micol: ""io sono uno viscerale. Magari ti mando a fan©ulo, ma poi posso parlare solo bene di te, anche se non te lo dico"". gfvip  daniele  nikiters  incorvassi  iostoconnikita  iostoconmicol  micol  ciupi  ciupita  onestini  salottiners ",#gfvip#daniele#nikiters#incorvassi#iostoconnikita#iostoconmicol#micol#ciupi#ciupita#onestini#salottiners,4,0.3182,Micol;Daniele
1598090072746004482,SilviaFranco965,2022-11-30 23:02:19+00:00,15,Il più grande spettacolo dopo il Big bang...siete voi ❤️ donnalisi  drojette  gfvip ,#donnalisi#drojette#gfvip,3,0.0,
1598090067368906755,edo_fanpage,2022-11-30 23:02:17+00:00,26,"Per tutti quelli che si chiedono la ragione per cui Edo si sia innamorato di lei, è tutto qui: Donnalisi  GFvip ",#Donnalisi#GFvip,3,0.0,
1598090054454644737,paolo_caciolli,2022-11-30 23:02:14+00:00,1,Capolavoro di Bellezza.❤️❤️ oriana  GFvip ,#oriana#GFvip,3,0.0,
1598090039455797248,edo_fanpage,2022-11-30 23:02:11+00:00,15,Il più grande spettacolo dopo il Big bang...siete voi ❤️ donnalisi  drojette  gfvip ,#donnalisi#drojette#gfvip,3,0.0,
1598090026881290242,ESTANCA2,2022-11-30 23:02:08+00:00,3,Giaele e Sara mi spezzano vi giuro ⚰️⚰️  gfvip  incorvassi,#gfvip#incorvassi,3,0.0,Giaele
1598090011756630017,vanigliastyles,2022-11-30 23:02:04+00:00,5,Luca: possono bere tutti tranne Micol Edo: quel tanto che basta per darla se Edoardo 😅  incorvassi  GFvip ,#incorvassi#GFvip,4,0.3612,Luca;Luca;Micol;Edoardo;Edoardo
1598089989237411840,Loris71626264,2022-11-30 23:01:59+00:00,41,Tutto mi aspettavo tranne vedere il polletto commosso 😭♥️ Donnalisi  GFVIP ,#Donnalisi#GFVIP,4,0.2732,
1598089972170788866,itssmanueel,2022-11-30 23:01:55+00:00,43,"Giaele: -“È la prima volta che ne parliamo così tutti assieme cosa cambia? Dobbiamo parlarne per un'altra ora?”Ma Antonella perché si agita così tanto, se in tutto questo non c'entra un tubo?Ah giusto, prepara la clip per lunedì GIAELE PERFETTA  gfvip  nikiters  incorvassi ",#gfvip#nikiters#incorvassi,3,0.0,Antonella
1598089959231361024,Lisahahahahah,2022-11-30 23:01:52+00:00,0, Oh ma sti vecchi sempre in una delle due regie eh?!  incorvassi  gfvip,#incorvassi#gfvip,3,0.0,
1598089953845518336,Oscar_PLlamas,2022-11-30 23:01:50+00:00,0,"8ª Nomination di Grande Fratello VIP 7: Luciano, Micol e PatriziaChi vuoi salvare?Luciano: 16,2%Micol: 59,1%Patrizia: 24,7%RT e ❤️per più voti gfvip  oriana  gintonic  donnalisi  nikiters  incorvassi  gioiellers ",#gfvip#oriana#gintonic#donnalisi#nikiters#incorvassi#gioiellers,5,0.6166,Micol;Patrizia
1598089940277301248,Fabio_er_mejo,2022-11-30 23:01:47+00:00,4,Aiutateci e contribuite al 2^ aereo per Oriana.Grazie! gfvip  oriana  orianistas  iostoconoriana,#gfvip#oriana#orianistas#iostoconoriana,3,0.0,Oriana
1598089931603464192,Duazfan,2022-11-30 23:01:45+00:00,2," Nikita non è sciocca, se vede che non va, si riprenderà e smetterà di farsene un problema.  gfvip  nikiters",#gfvip#nikiters,3,0.0,Nikita
1598089925618208781,giovy_maio,2022-11-30 23:01:43+00:00,11,NON CE LA FACCIO PIÙ ⚰️😂  gfvip  incorvassi  gintonic ,#gfvip#incorvassi#gintonic,4,0.4404,
1598089910300291073,MicheleAngeril,2022-11-30 23:01:40+00:00,9,"Non so come andrà ma Nikita per la prima volta ha trovato qualcuno che la difende come si deve.Per me Onestini si sta comportando da vero gentleman,in tutti i sensi.Da qualche giorno vedo dei segnali positivi anche da parte sua,spero di non dovermi ricredere.  nikiters  gfvip",#nikiters#gfvip,4,0.34,Nikita
1598089885143175172,totalatypical,2022-11-30 23:01:34+00:00,14,"vi prego la prima volta che forum mi fa davvero scompisciare, lui ha raggiunto il limite non ce la fa più ha bisogno di aiuto  gfvip  incorvassi ",#gfvip#incorvassi,5,0.5859,
1598089845163036672,suarin1969,2022-11-30 23:01:24+00:00,23,PER FAVORE MA COSA C’ERA NEL VINO DI GIAELE E SARAH  GFVIPOnestini ti amo   incorvassi ,#GFVIPOnestini#incorvassi,3,0.0,Sarah
1598089842294165508,Ugo51010905,2022-11-30 23:01:24+00:00,0, Nessuno di noi li aveva mai visti così  donnalisi  gfvip,#donnalisi#gfvip,3,0.0,
1598089834559844352,SoyMareluna,2022-11-30 23:01:22+00:00,35,Daniele ogni volta che parla mi spezza il cuore 💔💔💔 ha un mondo dentro e soffre tantissimo 😭  incorvassi gfvip  ,#incorvassi#gfvip# ,5,0.5574,Daniele
1598089833150582790,maparliamodime,2022-11-30 23:01:21+00:00,69,"Antonella a cena con Edo: ""In questo posto PRIVATO""NOI: Donnalisi  GFvip ",#Donnalisi#GFvip,3,0.0,
1598089830235541510,gossipg65060731,2022-11-30 23:01:21+00:00,0,Nessuno che va a vedere perché George sta lì solo in giardino. Che schifo. gfvip  incorvassi  nikiters,#gfvip#incorvassi#nikiters,3,0.0,George
