Id,Screen_name,Created_at,Retweet,Text,Hashtags,Sentiment,Compound,Ents
1598460403864018944,AmorMicchi,2022-12-01 23:33:52+00:00,1,REGIA PER FAVORE EDO E MICOL  GFVIP   incorvassi,#GFVIP#incorvassi,3,0.0,
1598460402861576193,Mariate08469480,2022-12-01 23:33:52+00:00,41,"Micol su Nikita: “Però è bello, è sincera raga, cioè almeno voglio dire c'è gente che manco te lo dice e poi ti vedi le puntate...”Le altre che si lamentano di Nikita e poi c'è Micol che subito la difende quando c'è da farlo vi prego 😭🤍 gfvip  nikiters  incorvassi ",#gfvip#nikiters#incorvassi,1,-0.7269,Micol;Nikita
1598460393718153216,limecade83,2022-12-01 23:33:50+00:00,0,ma possiamo tornare a edo e micol .che c e frega di Antonino  incorvassi  gfvip,#incorvassi#gfvip,3,0.0,Antonino
1598460391209721856,bitch_C18,2022-12-01 23:33:49+00:00,0,Ehm..possiamo tornare sugli  Incorvassi? Per favore?  GFVIP,#Incorvassi?#GFVIP,3,0.0,
1598460386885472257,crispyfede1,2022-12-01 23:33:48+00:00,0,"Io non credo lei non abbia interesse. È bastato averlo vicino 5 minuti oggi e lei è rinata. Sorrideva,lo cercava con gli sguardi e le mani,voleva un contatto. Per me lei ha troppa paura del contesto.E le opzioni sono2: o riesce ad andare oltre, o finirà male.  gfvip   incorvassi",#gfvip#incorvassi,4,0.34,
1598460378203451392,Argutamente,2022-12-01 23:33:46+00:00,2,Vabbè peró andate in un'altra stanza  gfvip  incorvassi  ASPETTIAMO DA DUE GIORNI,#gfvip#incorvassi,3,0.0,
1598460377326551042,AmorMicchi,2022-12-01 23:33:46+00:00,1,DATECI TAVASSI E MICOL  incorvassi   gfvip,#incorvassi#gfvip,3,0.0,Micol
1598460376802545665,ChiaraMinzio,2022-12-01 23:33:46+00:00,7,"A leggere qui sembra che Nikita sia talmente gelosa che sia andata in piazza a prendere per i capelli qualcuna, invece ha voluto solo chiarezza con Luca su alcuni aspetti, in modo pacato è civile.  gfvip  nikiters  donnalisi  incorvasi ",#gfvip#nikiters#donnalisi#incorvasi,4,0.34,Nikita;Luca;Luca
1598460374281584641,3Mastri,2022-12-01 23:33:45+00:00,14,"One:oggi è stata 1bruttissima giornata,nn mi hai parlato Nik:ma ieri hai detto che sono tua amica mi sono comportata da taleOne:t ho detto che sto bene con te e nn ho detto ne che nn può nascere nulla ne che nasceràNiki: allora mi proteggo  gfvip  nikiters",#gfvip#nikiters,3,0.0,
1598460353163235331,Federic45514513,2022-12-01 23:33:40+00:00,7,il modo in cui stasera Micol ha difeso Nikita davanti alle altre Quest'amicizia e alleanza  gfvip  nikiters  incorvassi ,#gfvip#nikiters#incorvassi,4,0.34,Micol;Nikita
1598460352127270912,manuestrella6,2022-12-01 23:33:40+00:00,0," gfvip  incorvassi Micol è andata a prendere la sigaretta tutta felice , boh io non la capisco 😅",#gfvip#incorvassi,4,0.3612,Micol
1598460349476380678,AnnaD_27,2022-12-01 23:33:39+00:00,0,regia gli  incorvassi che cavolo ce ne frega di 🔌 e oriana ma daiiiii   GFvip,#incorvassi#GFvip,3,0.0,
1598460347366936577,daymelloreal7,2022-12-01 23:33:39+00:00,8,Ciarly parla con Alby d One che le ha detto che è rimasto scottato dall'amore ma a lui Nikita piace solo che ha paura a lasciarsi andare xché vuole essere sicuroE secondi Ciarly invece si dovrebbe lasciar andare e vivere Alby dice che xrò è bello andare piano  gfvip  nikiters,#gfvip#nikiters,5,0.5859,Nikita
1598460346552967171,esauritapro,2022-12-01 23:33:39+00:00,0,È tutta la sera che aspettiamo questo confronto e questi cambiano   gfvip  incorvassi,#gfvip#incorvassi,3,0.0,
1598460331726077954,Sarahh68595083,2022-12-01 23:33:35+00:00,2,Vabbè peró andate in un'altra stanza  gfvip  incorvassi  ASPETTIAMO DA DUE GIORNI,#gfvip#incorvassi,3,0.0,
1598460310301675523,ChiaraMinzio,2022-12-01 23:33:30+00:00,22,"non la bastardona di Antonella Fiordelisi che colleziona ben 16 aerei in due mesi di programma e voi qua a piangere perche i vostri comodini preferiti ne hanno avuti si e no 5 😭🙏🏼o donate o non piangete, fatevene una ragione !! donnalisi  gfvip ",#donnalisi#gfvip,1,-0.7081,Antonella
1598460302412374016,memiariel,2022-12-01 23:33:28+00:00,0,Regia stai scherzando??  gfvip  INCORVASSI ,#gfvip#INCORVASSI,3,0.0,
1598460297085423617,2ghostshearts,2022-12-01 23:33:27+00:00,1,DATECI TAVASSI E MICOL  incorvassi   gfvip,#incorvassi#gfvip,3,0.0,Micol
1598460295537737731,Lisahahahahah,2022-12-01 23:33:27+00:00,2,Vabbè peró andate in un'altra stanza  gfvip  incorvassi  ASPETTIAMO DA DUE GIORNI,#gfvip#incorvassi,3,0.0,
1598460295256899585,Valenti59332692,2022-12-01 23:33:27+00:00,72,"Per me è George che si butta nel bel mezzo della discussione per difendere Nikita George non è un semplice ragazzino, È un uomo e piscia in testa a tutti gli altri uomini (che tanto decantano di essere) della casa.GRAZIE GEORGE 🤍 gfvip  nikiters  incorvassi ",#gfvip#nikiters#incorvassi,3,0.0,George;Nikita
1598460291813081089,Emanuel07281346,2022-12-01 23:33:26+00:00,0,Il vero Onestini e’ quello che abbiamo visto stasera con Tavassi e Antonella! Lo stesso che era ai tempi del  gfvip con Invana e Raffaello ! Con L’ arpia  sembra tutto impostato !  gfvip  donnalisi ,#gfvip#gfvip#donnalisi,3,0.0,
1598460286498906113,needhishug_,2022-12-01 23:33:24+00:00,1,REGIA PER FAVORE EDO E MICOL  GFVIP   incorvassi,#GFVIP#incorvassi,3,0.0,
1598460269964959745,LukIs4Losers,2022-12-01 23:33:20+00:00,0,Ma vaffanculo ce li avete tolti!! Si discorsi seri tra l’altro! Ma andate a cagare voi oriana e antonino!  gfvip  incorvassi,#gfvip#incorvassi,3,0.0,
1598460269659049984,aoosoioo,2022-12-01 23:33:20+00:00,0, regia per favore sugli  incorvassi cazoooooo  gfvip,#incorvassi#gfvip,3,0.0,
1598460259911221250,danicla85,2022-12-01 23:33:18+00:00,1,"Edo a Micol: io a te non te lo devo di, te lo devo stra di  incorvassi  GFvip ",#incorvassi#GFvip,3,0.0,
1598460255972855808,SerenaMarano6,2022-12-01 23:33:17+00:00,24,"Antonella a Tavassi indicando Micol: Edo, guarda che sta un po giù. Me ne sono accorta ora.Edoardo si gira e va da Micol ad abbracciarla.Edoardo: Subito è andato.I  donnalisi sorridono alla scena.BHO SONO DIVENTATI I CAPO SHIP DEGLI  incorvassi  GFVIP ",#donnalisi#incorvassi#GFVIP,1,-0.5574,Edoardo;Edoardo;Micol
1598460253179645952,idratta_ro,2022-12-01 23:33:16+00:00,0,Regia Tavassi e Micol  gfvip  incorvassi,#gfvip#incorvassi,3,0.0,Micol
1598460239543672832,AuroraMorgavi,2022-12-01 23:33:13+00:00,1,Oooo regiaaaaaaa non ci interessa  gfvip  incorvassi,#gfvip#incorvassi,3,0.0,
1598460230253297665,CiotolaRebecca,2022-12-01 23:33:11+00:00,39,"Nikita ""mi hai raccontato tornando da Spagna non riuscivi a parlare italiano e chi c'è rimasto male? TUO NONNO?""Luca ""tuo nonno?TONON il mio amicone!"" ahahahah  gfvip  nikiters ",#gfvip#nikiters,3,0.0,
1598460227858333696,aur24,2022-12-01 23:33:10+00:00,8,Quindi si erano accorti che Nikita stesse piangendo ma se ne sono fregati comunque. Complimenti.  nikiters  gfvip,#nikiters#gfvip,3,0.0,Nikita
1598460212087865344,Sandy___8,2022-12-01 23:33:07+00:00,0,No REGIA NON SCHERZIAMO METTI MICOL ED EDOARDO SUBITO TORNA DA LORO SONO VENTIQUATTR'ORE CHE CERCHIAMO DI CAPIRE   gfvip  INCORVASSI,#gfvip#INCORVASSI,2,-0.296,Micol;Edoardo;Edoardo
1598460209139417088,Tiziana58511518,2022-12-01 23:33:06+00:00,2,L'hashtag di daniele e micol è ♥️.. M I E L E.. ♥️ miele  gfvip  donnalisi  gintonic  salottiners  denzzzers  prelemi  nikiters  giacol  micol,#miele#gfvip#donnalisi#gintonic#salottiners#denzzzers#prelemi#nikiters#giacol#micol,5,0.9206,Daniele
1598460201715523586,AozazoY,2022-12-01 23:33:04+00:00,0,Dai lo aspettavo da due giorni  gfvip  incorvassi,#gfvip#incorvassi,3,0.0,
1598460196698963974,BerAliona,2022-12-01 23:33:03+00:00,3,Ma vi lamentate della regia su Nikita e One quando x tutto il giorno avete visto altro e poi in veranda nn sono soli ci sono anche altre personePs. È lui che l'ha cercata sta sera  gfvip  nikiters,#gfvip#nikiters,3,0.0,Nikita
1598460193012080640,pupapeligrosah,2022-12-01 23:33:02+00:00,7,il modo in cui stasera Micol ha difeso Nikita davanti alle altre Quest'amicizia e alleanza  gfvip  nikiters  incorvassi ,#gfvip#nikiters#incorvassi,4,0.34,Micol;Nikita
1598460190638186497,ElisabettaScog3,2022-12-01 23:33:02+00:00,3,"Tavassi che fa tutto quello che ha criticato ad Edoardo, dicendo che innamorarsi li era impossibile, che non era vero che 1 mese li equivale a di più, che le persone le conosci fuori, com'era??? 🤡🤡  gfvip  donnalisi",#gfvip#donnalisi,4,0.4479,Edoardo;Edoardo
1598460176490700807,SerenaMarano6,2022-12-01 23:32:58+00:00,28,E: Antonella mi dice le cose carine su Micol a bassa voce per non farsi sentire da Micol. Si vergogna di dirla ad alta voce.T: ANTONELLA È BUONA!E-T-M insieme: ANTONELLA È BUONA! T: Cosa hai detto?A: Che è simpatica e dolce. 💜 GFVIP  donnalisi  incorvassi ,#GFVIP#donnalisi#incorvassi,5,0.6988,Micol;Antonella
1598460155691241473,SL4YLENA0,2022-12-01 23:32:53+00:00,0,Regia però eh  GFVIP  incorvassi,#GFVIP#incorvassi,3,0.0,
1598460139069112321,CosimaEstancah,2022-12-01 23:32:49+00:00,0,Regiaaaaaaa porco cazzooooooooo!  gfvip  incorvassi,#gfvip#incorvassi,3,0.0,
1598460136074674176,ChiaraMinzio,2022-12-01 23:32:49+00:00,17,Luca Onestini non ha mai illuso Nikita.Questo vittimizzarla sempre accusando anche chi non ha fatto nulla HA STANCATO.C’è rimasta male? Comprensibile.È colpa di Onestini? NO.( Oriana cosa doveva fare allora? ) Tutto troppo.  GFVIP  donnalisi,#GFVIP#donnalisi,5,0.8163,Luca;Luca;Oriana
1598460125651533826,alan_hibic,2022-12-01 23:32:46+00:00,39,"Nikita ""mi hai raccontato tornando da Spagna non riuscivi a parlare italiano e chi c'è rimasto male? TUO NONNO?""Luca ""tuo nonno?TONON il mio amicone!"" ahahahah  gfvip  nikiters ",#gfvip#nikiters,3,0.0,
1598460121746911233,latteinpiedi,2022-12-01 23:32:45+00:00,1,REGIAAAAAAA CAZZO MICOL ED EDO T.  gfvip   incorvassi,#gfvip#incorvassi,3,0.0,Micol
1598460107834404864,Suffo89,2022-12-01 23:32:42+00:00,0,Se ciao.   INCORVASSI  GFvip,#INCORVASSI#GFvip,3,0.0,
1598460104860377088,cMmCuore,2022-12-01 23:32:41+00:00,0,Regiaaa  ci interessa di Edoardo e Micol  gfvip  incorvassi,#gfvip#incorvassi,3,0.0,Edoardo;Edoardo;Micol
1598460093846016002,Mimma22851036,2022-12-01 23:32:38+00:00,7,Finalmente un bel sorriso!🫶  GFvip  LucaOneGFVip  nikita  nikiters  iostoconnikita ,#GFvip#LucaOneGFVip#nikita#nikiters#iostoconnikita,3,0.0,
1598460092977905669,Duazfan,2022-12-01 23:32:38+00:00,3,"Tavassi che fa tutto quello che ha criticato ad Edoardo, dicendo che innamorarsi li era impossibile, che non era vero che 1 mese li equivale a di più, che le persone le conosci fuori, com'era??? 🤡🤡  gfvip  donnalisi",#gfvip#donnalisi,4,0.4479,Edoardo;Edoardo
1598460073856192513,ChiaraMinzio,2022-12-01 23:32:34+00:00,11,"I piu belli, il trio fatto di emozioni, simpatia, complicità, amore amicizia. Questo è il gf!!! Li amiamo per questo, per tutto ciò che ci trasmettono ogni giorno. 😍🥰Loro sono Casa, un porto sicuro.❤❤❤❤❤❤❤❤❤❤❤❤❤ donnalisi  gfvip ",#donnalisi#gfvip,5,0.9965,
1598460073239785472,AozazoY,2022-12-01 23:32:34+00:00,0,No dai regiaaaaa  gfvip  incorvassi,#gfvip#incorvassi,2,-0.296,
1598460072879075329,serperuta,2022-12-01 23:32:33+00:00,7,EdoT:”Ho capito che ci sto e non ci sto a te non frega un cazzo” Micol:”Ma hai totalmente sbagliato”   incorvassi gfvip,#incorvassi#gfvip,3,0.0,Micol
1598460020546756609,Valenti59332692,2022-12-01 23:32:21+00:00,138,"Charlie: “Sicuramente 1 dolcificante per Antonino c'è”Salatino: “Ma ce ne stanno 4”SALATINO DICE CHE CI SONO 4 DOLCIFICANTI PER ANTONINO.QUESTA È LA CONFERMA CHE È STATO TUTTO UN PRETESTO PER ANDARE CONTRO NIKITA, CHE SCHIFO. gfvip  nikiters  incorvassi ",#gfvip#nikiters#incorvassi,3,0.0,Antonino
1598460016935456768,BAliceB90,2022-12-01 23:32:20+00:00,7,EdoT:”Ho capito che ci sto e non ci sto a te non frega un cazzo” Micol:”Ma hai totalmente sbagliato”   incorvassi gfvip,#incorvassi#gfvip,3,0.0,Micol
1598460014443757568,ElisabettaScog3,2022-12-01 23:32:20+00:00,4,EdoT che ha tanto criticato il rapporto di Anto ed EdoD adesso sta vivendo sulla pelle le stesse emozioniIl karma  donnalisi  gfvip  incorvassi,#donnalisi#gfvip#incorvassi,4,0.34,
1598460000204197889,rosalbarosa96,2022-12-01 23:32:16+00:00,3,"Tavassi che fa tutto quello che ha criticato ad Edoardo, dicendo che innamorarsi li era impossibile, che non era vero che 1 mese li equivale a di più, che le persone le conosci fuori, com'era??? 🤡🤡  gfvip  donnalisi",#gfvip#donnalisi,4,0.4479,Edoardo;Edoardo
1598459999457796097,alan_hibic,2022-12-01 23:32:16+00:00,1,"Dai Onestini che è tutta sta noia, lo capisci che non deve ridere Nikita ma il pubblico? Suvvia  onestini  nikita  nikiters  GFvip ",#onestini#nikita#nikiters#GFvip,3,0.0,Nikita
1598459928787787776,blujasmine3,2022-12-01 23:31:59+00:00,7,EdoT:”Ho capito che ci sto e non ci sto a te non frega un cazzo” Micol:”Ma hai totalmente sbagliato”   incorvassi gfvip,#incorvassi#gfvip,3,0.0,Micol
1598459928695513088,Mariate08469480,2022-12-01 23:31:59+00:00,38,"Nikita su Onestini: “Non dico niente, avrei preferito che, sapendo che per me non era differente si comportasse in maniera diversa a questo punto”HA RAGIONE.  gfvip  nikiters  incorvassi ",#gfvip#nikiters#incorvassi,3,0.0,
1598459928452251648,Codename1onesto,2022-12-01 23:31:59+00:00,0," GFvip Se l'amore non scatta non scatta!Al massimo ci può essere una tenera amicizia, io penso che il buon Tavassi abbia puntato troppo su qualcosa che va oltre l'amicizia. INCORVASSI ",#GFvip#INCORVASSI,3,0.0,
1598459906520240128,Valenti59332692,2022-12-01 23:31:54+00:00,26,Non Luca che per dare il palo istantaneo a Sarah le fa il dito medio con la mano di Nikita 😹  gfvip  nikiters ,#gfvip#nikiters,4,0.4404,Luca;Luca;Sarah;Nikita
1598459903785451521,Nemeenya,2022-12-01 23:31:53+00:00,0,Io che attendo il limone degli  incorvassi   GFvip  micol  tavassi ,#incorvassi#GFvip#micol#tavassi,3,0.0,
1598459898873974784,pupapeligrosah,2022-12-01 23:31:52+00:00,39,"Nikita ""mi hai raccontato tornando da Spagna non riuscivi a parlare italiano e chi c'è rimasto male? TUO NONNO?""Luca ""tuo nonno?TONON il mio amicone!"" ahahahah  gfvip  nikiters ",#gfvip#nikiters,3,0.0,
1598459827331731457,Patri27102022,2022-12-01 23:31:35+00:00,17,La faccia di Onestini quando  Nikita dice “passionale pervertito” e poi vuole farsi dire una perversione 🤣🤣🤣  nikiters  gfvip ,#Nikita#nikiters#gfvip,5,0.765,Nikita
1598459826765529091,pupapeligrosah,2022-12-01 23:31:35+00:00,29,"“NIKITA VOLEVA SABOTARMI IO MANGIO SOLO IL DOLCIFICANTE,MI PROVOCA”Integrale non vuol dire senza zucchero.CHE CLOWN ANTONINO.  nikiters  gfvip ",#nikiters#gfvip,2,-0.4588,
1598459768804450308,BerAliona,2022-12-01 23:31:21+00:00,26,Non Luca che per dare il palo istantaneo a Sarah le fa il dito medio con la mano di Nikita 😹  gfvip  nikiters ,#gfvip#nikiters,4,0.4404,Luca;Luca;Sarah;Nikita
1598459721060597762,VALE70942077,2022-12-01 23:31:10+00:00,8,Ciarly parla con Alby d One che le ha detto che è rimasto scottato dall'amore ma a lui Nikita piace solo che ha paura a lasciarsi andare xché vuole essere sicuroE secondi Ciarly invece si dovrebbe lasciar andare e vivere Alby dice che xrò è bello andare piano  gfvip  nikiters,#gfvip#nikiters,5,0.5859,Nikita
1598459686138822656,Mel51987,2022-12-01 23:31:01+00:00,1,Perché in fondo… le vuole anche bene💔 donnalisi  incorvassi  gfvip ,#donnalisi#incorvassi#gfvip,4,0.2732,
1598459568610222083,xottaviax,2022-12-01 23:30:33+00:00,20,"Nikita: -“Son venuta a chiederti cosa succede perché non mi piaceva vederla così, perché comunque siete sempre a sorridere insieme, sempre a scherzare insieme ed è bello vedervi”Ieri Micol ha aiutato Niki, ora quest'ultima cerca di aiutare lei...🤍 gfvip  nikiters  incoevassi ",#gfvip#nikiters#incoevassi,4,0.34,Micol
1598459561974939648,aquilarealee88,2022-12-01 23:30:32+00:00,0,"Stasera una noia assurda, avete inquadrato gente per 3h che faceva pipponi e mai il gruppetto che scherzava GFvip  oriana  orianistas",#GFvip#oriana#orianistas,3,0.0,
1598459521231364096,iamaseaunicorn,2022-12-01 23:30:22+00:00,4,EdoT che ha tanto criticato il rapporto di Anto ed EdoD adesso sta vivendo sulla pelle le stesse emozioniIl karma  donnalisi  gfvip  incorvassi,#donnalisi#gfvip#incorvassi,4,0.34,
1598459483998810114,xottaviax,2022-12-01 23:30:13+00:00,29,"Micol su Nikita: “A volte non è che ti risponde male, a volte è un po' nel suo mondo. Quindi mi sembra molto seria”MICOL CHE DIFENDE NIKITA 🤍 gfvip  nikiters  incorvassi ",#gfvip#nikiters#incorvassi,3,0.0,Micol;Nikita
1598459388515303425,Vale41229116,2022-12-01 23:29:50+00:00,7,il modo in cui stasera Micol ha difeso Nikita davanti alle altre Quest'amicizia e alleanza  gfvip  nikiters  incorvassi ,#gfvip#nikiters#incorvassi,4,0.34,Micol;Nikita
1598459377497034752,Elisabe82157594,2022-12-01 23:29:48+00:00,3,Ma vi lamentate della regia su Nikita e One quando x tutto il giorno avete visto altro e poi in veranda nn sono soli ci sono anche altre personePs. È lui che l'ha cercata sta sera  gfvip  nikiters,#gfvip#nikiters,3,0.0,Nikita
1598459373944291330,xottaviax,2022-12-01 23:29:47+00:00,34,"Comunque la falsità di Sarah che dietro sparla di Nikita e poi davanti fa tutta l'amica parlando tranquillamente anche no, è proprio imbarazzante. gfvip  nikiters  incorvassi ",#gfvip#nikiters#incorvassi,3,0.0,Sarah;Nikita
1598459359410929665,Mel51987,2022-12-01 23:29:43+00:00,2,"💝 Cura, premura, tenerezza,  donnalisi  gfvip Io mi sciolgo. Come si fa a non amare Antonella !!.. ",#donnalisi#gfvip,5,0.6988,Antonella
1598459331984384000,Gina35415084,2022-12-01 23:29:37+00:00,4,La doccia… e tutti con la bava 😂😂  donnalisi  gfvip 4Qui Edo va a fare una carezza a Onestini “come per dirgli accuccia che stai oltre” io l’ho vista così… certo ci vuole fegato a star con lei lì davanti a tutti a far la doccia e te la guardano e non puoi far nnt ♥️ ,#donnalisi#gfvip,5,0.875,
1598459266259906564,danilomba1962,2022-12-01 23:29:21+00:00,108,"perché se incontrarsi resta una magia, è non perdersi la vera favola ✨💘  donnalisi  GFvip ",#donnalisi#GFvip,5,0.7579,
1598459265315999750,Emanuel07281346,2022-12-01 23:29:21+00:00,0,Così piace vederti ! Che ti diverti e vaffanculo  tutto ♥️  gfvip  donnalisi ,#gfvip#donnalisi,5,0.6696,
1598459264728985606,lorisz841,2022-12-01 23:29:21+00:00,1,"Micol ha difeso  nikita per modo di dire,poteva evitare di fare i riportino a sara visto che a lei piace  GFvip",#nikita#GFvip,4,0.34,Micol
1598459241773285377,serperuta,2022-12-01 23:29:15+00:00,4,Micol che riesce a distruggere tutti in puntata e con EdoT non riesce a parlare   incorvassi gfvip,#incorvassi#gfvip,3,0.0,
1598459194809647106,AngelaAlberti10,2022-12-01 23:29:04+00:00,26,Non Luca che per dare il palo istantaneo a Sarah le fa il dito medio con la mano di Nikita 😹  gfvip  nikiters ,#gfvip#nikiters,4,0.4404,Luca;Luca;Sarah;Nikita
1598459097103626244,MacaioneDesy,2022-12-01 23:28:41+00:00,2,Edo e Micol finalmente chiariscono ❤️  incorvassi  GFvip ,#incorvassi#GFvip,3,0.0,Micol
1598459089746817034,lorisz841,2022-12-01 23:28:39+00:00,0,Cmq quelli che dicono che micol ha difeso nikita contro le tre arpie se quella l'ha chiamata difesa  ma dove dai  GFVIP  nikiters,#GFVIP#nikiters,4,0.34,
1598459080854601734,cheridere0,2022-12-01 23:28:37+00:00,16,"Chiariamo: Micol ha parlato con le altre dell'argomento Nikita/Onestini perchè è uscito lì il discorso, ma l'importante è che l'ha difesa quindi di cosa stiamo parlando? È stata l'unica a difenderla e io l'ho apprezzata 🤍 gfvip  nikiters  incorvassi",#gfvip#nikiters#incorvassi,4,0.34,Nikita
1598459057022672896,xottaviax,2022-12-01 23:28:31+00:00,3,Nikita sta facendo con Tavassi quello che Micol ha fatto per lei stanotte con Onestini ❤️.  Nikiters  Incorvassi  amiche  gfvip,#Nikiters#Incorvassi#amiche#gfvip,4,0.34,Micol
1598459051519647744,Rita92449842,2022-12-01 23:28:30+00:00,1,"Micol ha difeso  nikita per modo di dire,poteva evitare di fare i riportino a sara visto che a lei piace  GFvip",#nikita#GFvip,4,0.34,Micol
1598459043714039809,cheridere0,2022-12-01 23:28:28+00:00,34,"Comunque la falsità di Sarah che dietro sparla di Nikita e poi davanti fa tutta l'amica parlando tranquillamente anche no, è proprio imbarazzante. gfvip  nikiters  incorvassi ",#gfvip#nikiters#incorvassi,3,0.0,Sarah;Nikita
1598459023933710337,MacaioneDesy,2022-12-01 23:28:23+00:00,31,"Antonella ""guarda che la vedo trist-"" *edot parte subito e la abbraccia*edod ""neanche il tempo di dirlo ed è partito subito.""❤️‍🩹❤️‍🩹 gfvip  incorvassi ",#gfvip#incorvassi,3,0.0,Antonella
1598458990324744195,tiziana1974,2022-12-01 23:28:15+00:00,34,"Comunque la falsità di Sarah che dietro sparla di Nikita e poi davanti fa tutta l'amica parlando tranquillamente anche no, è proprio imbarazzante. gfvip  nikiters  incorvassi ",#gfvip#nikiters#incorvassi,3,0.0,Sarah;Nikita
1598458982540214274,xottaviax,2022-12-01 23:28:14+00:00,30,"L'unica donna della casa di cui Nikita si può seriamente fidare ad oggi è Micol, e questa sera l'ha dimostrato difendendola davanti alle altre ❤ gfvip  nikiters  incorvassi ",#gfvip#nikiters#incorvassi,5,0.6369,Nikita
1598458979587350528,cesialion,2022-12-01 23:28:13+00:00,4,QUESTA DONNA AHAHAH ti amo Oriana 😂😂😂😂  gfvip  donnalisi ,#gfvip#donnalisi,5,0.891,Oriana
1598458954748776449,Alessia71702475,2022-12-01 23:28:07+00:00,3,Compilation di Antonella che ripete la parola ignavo... potrebbe essere più lunga di games of thrones  gfvip  incorvassi  nikiters ,#gfvip#incorvassi#nikiters,3,0.0,Antonella
1598458951842107394,Gina35415084,2022-12-01 23:28:06+00:00,4,La doccia… e tutti con la bava 😂😂  donnalisi  gfvip 2 ,#donnalisi#gfvip,5,0.7003,
1598458936981688321,xottaviax,2022-12-01 23:28:03+00:00,53,"Nikita: -“Come mai mangiate qui?”Micol: -“Io perché preferisco mangiare qua, lui perché vuole stare vicino a me”Nikita: -“Tutto bene Michi?”Micol: -“Si, tu?”LA MIE BIMBE DOLCISSIME 🥹🤍 gfvip  nikiters  incorvassi ",#gfvip#nikiters#incorvassi,3,0.0,
1598458926609080321,Elisabe82157594,2022-12-01 23:28:00+00:00,26,Non Luca che per dare il palo istantaneo a Sarah le fa il dito medio con la mano di Nikita 😹  gfvip  nikiters ,#gfvip#nikiters,4,0.4404,Luca;Luca;Sarah;Nikita
1598458924142837761,AleAleeeeee,2022-12-01 23:28:00+00:00,4,"Tra l’altro fa sta cosa con tutti. Sia con Micol, che con Nikita ecc.. GFvip  nikiters  incorvassi ",#GFvip#nikiters#incorvassi,3,0.0,Nikita
1598458910155108355,VALE70942077,2022-12-01 23:27:56+00:00,3,Ma vi lamentate della regia su Nikita e One quando x tutto il giorno avete visto altro e poi in veranda nn sono soli ci sono anche altre personePs. È lui che l'ha cercata sta sera  gfvip  nikiters,#gfvip#nikiters,3,0.0,Nikita
1598458896129134592,Sofia17324238,2022-12-01 23:27:53+00:00,8,Quindi si erano accorti che Nikita stesse piangendo ma se ne sono fregati comunque. Complimenti.  nikiters  gfvip,#nikiters#gfvip,3,0.0,Nikita
1598458894686224386,Gina35415084,2022-12-01 23:27:53+00:00,12,La doccia… e tutti con la bava 😂😂  donnalisi  gfvip 1 ,#donnalisi#gfvip,5,0.7003,
1598458880270471168,Fabio_er_mejo,2022-12-01 23:27:49+00:00,0,"Attilio""Io le sigarette non le ho mai comprate dal tabaccaio, ma di contrabbando!""😂😂😂😂😂E fu così che alla sua uscita Attilione fu' arrestato! gfvip  oriana",#gfvip#oriana,5,0.6792,Attilio
1598458879934955521,MDaje7,2022-12-01 23:27:49+00:00,4,"Tra l’altro fa sta cosa con tutti. Sia con Micol, che con Nikita ecc.. GFvip  nikiters  incorvassi ",#GFvip#nikiters#incorvassi,3,0.0,Nikita
1598458870657175552,Spettegulesss1,2022-12-01 23:27:47+00:00,5,Nikita in cotta per Onestini.Sara che ha appena ammesso che le piace Onestini.Giaele pensa che Onestini é il più bello e lo difende.Che casino.  gfvip  nikiters  incorvassi ,#gfvip#nikiters#incorvassi,4,0.34,Giaele
1598458854446096385,fulginitigiada,2022-12-01 23:27:43+00:00,6,"Siamo noi, siamo noi, i fans della Patty siamo noi 🎶 ✈️💄❤️ e Antonella lo aveva capito 😀  PattyLipstick  gfvip  SalviamoPatrizia  donnalisi ",#PattyLipstick#gfvip#SalviamoPatrizia#donnalisi,4,0.3612,Antonella;Patrizia
1598458850381897730,Ivana170593,2022-12-01 23:27:42+00:00,0,Quando dicono che Anto e' cattiva e non e' empatica.... Questo perché non la conoscono come la conosciamo noi...ma lei e' questo ❤️ e' la prima che nota una persona che sta male o che e' brava e lei lo sa' di Micol  INCORVASSI  donnalisi  gfvip ,#INCORVASSI#donnalisi#gfvip,3,0.0,Micol
1598458845155786753,cheridere0,2022-12-01 23:27:41+00:00,30,"L'unica donna della casa di cui Nikita si può seriamente fidare ad oggi è Micol, e questa sera l'ha dimostrato difendendola davanti alle altre ❤ gfvip  nikiters  incorvassi ",#gfvip#nikiters#incorvassi,5,0.6369,Nikita
1598458819876642823,lillalalu,2022-12-01 23:27:35+00:00,4,"Tra l’altro fa sta cosa con tutti. Sia con Micol, che con Nikita ecc.. GFvip  nikiters  incorvassi ",#GFvip#nikiters#incorvassi,3,0.0,Nikita
1598458799630831616,MacaioneDesy,2022-12-01 23:27:30+00:00,6," INCORVASSI  GFvip La ""sigaretta"" (Pt.2) ",#INCORVASSI#GFvip,3,0.0,
1598458799135793152,tonyspillo,2022-12-01 23:27:30+00:00,2,Provate a guardare questo video senza ridere... gfvip  gfvip7  nikiters  donnalisi  teamtavassi  incorvassi ,#gfvip#gfvip7#nikiters#donnalisi#teamtavassi#incorvassi,3,0.0,
1598458777522552832,BerAliona,2022-12-01 23:27:25+00:00,4,Hahahahah Sarah ha preso subito il palo da Onestini che gli fa il dito medio con la mano di Nikita🤣⚰️  gfvip  nikiters,#gfvip#nikiters,5,0.6808,Sarah;Nikita
1598458776335654913,Spettegulesss1,2022-12-01 23:27:24+00:00,3,"Giaele: Io lo detto, per me il più bello della casa e Onestini.  gfvip  incorvassi  nikiters ",#gfvip#incorvassi#nikiters,3,0.0,
