Id,Screen_name,Created_at,Retweet,Text,Hashtags,Sentiment,Compound,Ents
1597008826947239937,titti1234567788,2022-11-27 23:25:49+00:00,3,Ma giale ti vuoi preoccupare per tuo marito invece di pensare alla competizione con oriana? Tylor ti ha detto che la situazione fuori non va bene e questa pensa ad antonino!🤦🏻‍♀️  gfvip  donnalisi  nikiters  incorvassu,#gfvip#donnalisi#nikiters#incorvassu,4,0.4003,
1597008809373106176,Argutamente,2022-11-27 23:25:45+00:00,0,Cosa manca per il centro anziani? Le bocce?RIDATECI IL CORTILETTOOOOOOOO!!!!!  incorvassi gfvip ,#incorvassi#gfvip#,3,0.0,
1597008786308276224,meandmilli,2022-11-27 23:25:40+00:00,0,Regia CORTILETTO PER FAVORE  gfvip  incorvassi,#gfvip#incorvassi,3,0.0,
1597008785285185536,claireworld15,2022-11-27 23:25:40+00:00,2,"salatino entra come il romanaccio che fa ridere tutti, dopo una settimana diventa il cuoco che piagne si lamenta non ride mai IO PIENA IL SUO PERCORSO È FINITO BASTA  incorvassi gfvip",#incorvassi#gfvip,3,0.0,
1597008688069300227,Lovingy86127828,2022-11-27 23:25:16+00:00,61,QUESTO FOTTUTISSIMO CONCETTO donnalisi  GFvip ,#donnalisi#GFvip,3,0.0,
1597008680561836032,AmorMicchi,2022-11-27 23:25:15+00:00,3,"Antonella pensa di far ridere quando letteralmente ride solo lei,nemmeno il suo cane incorvassi  gfvip",#incorvassi#gfvip,3,0.0,Antonella
1597008659829051393,Lisahahahahah,2022-11-27 23:25:10+00:00,0,  CORTILETTO  incorvassi  gfvip,#incorvassi#gfvip,3,0.0,
1597008642837913603,Glaxs_Vlaxs,2022-11-27 23:25:06+00:00,0, iostoconantonella Piccola anima noi ti amiamo perché abbiamo sempre visto chi sei realmente dal gg 0 con te  donnalisi  fiorde  gfvip  Antonellafiordelisi  donnalisi ,#iostoconantonella#donnalisi#fiorde#gfvip#Antonellafiordelisi#donnalisi,4,0.296,
1597008605370552320,emmamartini22,2022-11-27 23:24:57+00:00,123,"“Non fosse stata mia sorella avrei speso lo stesso delle parole perché sono un brutto esempio di donne, sono le tipiche donne che odiano le altre donne, un cattivissimo, bruttissimo, messaggio che sta passando in televisione”CLIZIA 👏🏻 gfvip  incorvassi",#gfvip#incorvassi,2,-0.296,
1597008602170286082,DediuMarcella,2022-11-27 23:24:56+00:00,51,"Quanto si vede che Nikita, Micol, Edoardo Tavassi e Luca Onestini lo fanno sentire a proprio agio George, è così bello vederlo sorridere...🤍  gfvip  nikiters  incorvassi",#gfvip#nikiters#incorvassi,3,0.0,Nikita;Edoardo;Edoardo;Luca;Luca;George
1597008602065416192,fevdericolucia,2022-11-27 23:24:56+00:00,12,a me fa ridere perché è vero💀 GFvip  incorvassi ,#GFvip#incorvassi,3,0.0,
1597008503893561344,EmanLeon5,2022-11-27 23:24:32+00:00,20,"Giaele che dice ""che dolce che sei Wilma"" dopo lo schifo che Wilma ha detto su Nikita e Micol (e Giaele lo sa).. e dice che le è dispiaciuto per Elenoir (uscita per lo sputo e la cosa della sfiga).. bah 👎  gfvip  nikiters  incorvassi",#gfvip#nikiters#incorvassi,4,0.34,Giaele;Wilma;Nikita;Micol
1597008497014870017,ArdolinoPina,2022-11-27 23:24:31+00:00,12,a me fa ridere perché è vero💀 GFvip  incorvassi ,#GFvip#incorvassi,3,0.0,
1597008475342925824,bericomelius,2022-11-27 23:24:26+00:00,1,Ma Giaele ha detto davvero che le è dispiaciuto per Elenoire?  gfvip  nikiters  incorvassi  iostoconnikita ,#gfvip#nikiters#incorvassi#iostoconnikita,4,0.34,Giaele
1597008467998674944,quadrupedepelos,2022-11-27 23:24:24+00:00,3,"Antonella pensa di far ridere quando letteralmente ride solo lei,nemmeno il suo cane incorvassi  gfvip",#incorvassi#gfvip,3,0.0,Antonella
1597008455726149632,_SoniaRusso,2022-11-27 23:24:21+00:00,19,MA SONO ANDATE A METTERSI IN CORTILETTO PURE LORO VI PREGO 💀💀💀  gfvip  incorvassi ,#gfvip#incorvassi,3,0.0,
1597008439883878400,_SoniaRusso,2022-11-27 23:24:17+00:00,38,"Micol, Tavassi, Onestini, Nikita e George ridendo insieme all cortiletto. Chiaramente i mei favoriti. &lt;3  gfvip  incorvassi ",#gfvip#incorvassi,3,0.0,Nikita;George
1597008423966871552,ciuppina,2022-11-27 23:24:13+00:00,3,ma come rideeeeee George ahahahaha ❤  gfvip  nikiters  incorvassi ,#gfvip#nikiters#incorvassi,5,0.6369,George
1597008404970876928,notinmood131,2022-11-27 23:24:09+00:00,1,Neanche nel multiverso  incorvassi  gfvip ,#incorvassi#gfvip,3,0.0,
1597008397400150017,Danielamenna4,2022-11-27 23:24:07+00:00,38,"Micol: -“Appena torni dalla quarantena mi fai i complimenti per come mi sono comportata, e poi durante il gioco mi dici quella cattiveria?”MICOL LUCIDISSIMA SUL COMPORTAMENTO DI PATRIZIA 👏🏻 gfvip  incorvassi  nikiters ",#gfvip#incorvassi#nikiters,3,0.0,Micol;Patrizia
1597008359294582784,_0nlygoodvibes,2022-11-27 23:23:58+00:00,19, gfvip  incorvassi Cortiletto (Pt.2)LEI AMMETTE A LITTLE BIT ,#gfvip#incorvassi,3,0.0,
1597008347160776704,AngelaCoppola83,2022-11-27 23:23:55+00:00,7, gfvip  incorvassi Cortiletto Squad (Pt.6) ,#gfvip#incorvassi,3,0.0,
1597008283545763840,nonograzieh,2022-11-27 23:23:40+00:00,2,"😂😂😂😂 me sento male!Onestini vuole far vedere l'ano come prova della sua sincerità..EDO ""ERA NERO, È VERO!"" 😂😂😂😂 incorvassi  gfvip ",#incorvassi#gfvip,5,0.9712,
1597008280454561792,Giolis80,2022-11-27 23:23:39+00:00,3,Ma giale ti vuoi preoccupare per tuo marito invece di pensare alla competizione con oriana? Tylor ti ha detto che la situazione fuori non va bene e questa pensa ad antonino!🤦🏻‍♀️  gfvip  donnalisi  nikiters  incorvassu,#gfvip#donnalisi#nikiters#incorvassu,4,0.4003,
1597008278621278209,nadiuzza1987,2022-11-27 23:23:39+00:00,4, GFVIP  INCORVASSI Cortiletto Squad (Pt.1) ,#GFVIP#INCORVASSI,3,0.0,
1597008243934437376,_SoniaRusso,2022-11-27 23:23:30+00:00,11,la risata di george mi manda nell iperuranio per piacere  gfvip  incorvassi,#gfvip#incorvassi,3,0.0,George
1597008241778573312,Danielamenna4,2022-11-27 23:23:30+00:00,201,"Patrizia: “Devi anche pensare che lei (Antonella) ha 24 anni”Nikita: “Si anch'io ho avuto 24 anni e l'ho giustificata per 2 mesi con sta storia dei 24 anni, ma poi vedo George che ne ha 20 e dico ‘non posso giustificarla allora”NIKITA È AVANTI 👏🏻 gfvip  nikiters  incorvassi ",#gfvip#nikiters#incorvassi,5,0.5859,Patrizia;George
1597008187177041920,nadiuzza1987,2022-11-27 23:23:17+00:00,8, GFVIP  INCORVASSI Cortiletto Squad (Pt.2) ,#GFVIP#INCORVASSI,3,0.0,
1597008172517974016,koaliniprelemi,2022-11-27 23:23:13+00:00,0,Routine 🫶🏼💛Trio magnifico 💛 donnalisi  gfvip ,#donnalisi#gfvip,5,0.7906,
1597008166436294656,T_Belz,2022-11-27 23:23:12+00:00,23,"tavassi e Micol ripetono a Luca che si è fatto lo sbiancamento a*aleNikita ""Luca va tutto bene non c'è nessun problema questi son gusti""lui si abbassa i pantaloni per farglielo vedere a tutti ahahahhahahaha  gfvip  nikiters  incorvassi ",#gfvip#nikiters#incorvassi,3,0.0,Micol;Luca;Luca
1597008119762386945,StopAlleShip,2022-11-27 23:23:01+00:00,0," incorvassi  ciupilan  gfvip in cortiletto ridono,la regia ci propone questo🥶🥶🥶 ",#incorvassi#ciupilan#gfvip,3,0.0,
1597007994998308865,legodiary,2022-11-27 23:22:31+00:00,11,la risata di george mi manda nell iperuranio per piacere  gfvip  incorvassi,#gfvip#incorvassi,3,0.0,George
1597007981866291201,nadiuzza1987,2022-11-27 23:22:28+00:00,4, gfvip  incorvassi Cortiletto Squad (Pt.3) ,#gfvip#incorvassi,3,0.0,
1597007981828186113,legodiary,2022-11-27 23:22:28+00:00,8,La risata di George.⚰️⚰️⚰️ gfvip  incorvassi ,#gfvip#incorvassi,3,0.0,George
1597007975440605184,Danielamenna4,2022-11-27 23:22:26+00:00,54,"🚨🚨 BOOM:💣💣FONTI CERTE MI DICONO CHE CI SARÀ UNA FORTE RAMANZINA IN PUNTATA PER CHARLIE PATRIZIA E WILMA,SEGUONO SVILUPPI,SI STA PENSANDO IN QUESTE ORE ANCHE AD UN TELEVOTO FLASH... NOVITÀ A BREVISSIMO 🚨💣 gfvip incorvassi gintonic donnalisi nikiters orianamarzoli",#gfvip#incorvassi#gintonic#donnalisi#nikiters#orianamarzoli,1,-0.7506,Charlie;Patrizia
1597007908075581441,PozzuTu,2022-11-27 23:22:10+00:00,23,"tavassi e Micol ripetono a Luca che si è fatto lo sbiancamento a*aleNikita ""Luca va tutto bene non c'è nessun problema questi son gusti""lui si abbassa i pantaloni per farglielo vedere a tutti ahahahhahahaha  gfvip  nikiters  incorvassi ",#gfvip#nikiters#incorvassi,3,0.0,Micol;Luca;Luca
1597007900320624640,T_Belz,2022-11-27 23:22:09+00:00,21,"sfottono Nikita che sente l'energia delle rocceTavassi a Luca ""capito?Se ti metti con lei torni a casa la trovi a letto co na roccia""Luca ""attilio tu cosa dici?"" ""ti sei mai trombato una roccia?""Attilio ""no in genere io me so fatto male"" 🙈  gfvip  nikiters  incorvassi ",#gfvip#nikiters#incorvassi,3,0.0,Nikita;Luca;Luca;Attilio
1597007885653139456,anna12457384,2022-11-27 23:22:05+00:00,0,Voi siete talmente tanto disperati che Giaele possa essere preferita che cercate di fare di tutto per screditarla. Tranquilli che Nikita sarà lo stesso preferita non c’è bisogno di tutto questo sforzo!!  gfvip  gioiellers  incorvassi ,#gfvip#gioiellers#incorvassi,3,0.0,Giaele;Nikita
1597007843848515584,ef3b12e242cc4e7,2022-11-27 23:21:55+00:00,94,"Immaginate screditare,per il mero gusto di farlo, Edoardo e scoprire di perdersi una delle persone più pure e di cuore che abbia mai varcato la porta rossa❤️🩹  donnalisi  drojette  gfvip ",#donnalisi#drojette#gfvip,3,0.0,Edoardo;Edoardo
1597007827926515713,innazitutto,2022-11-27 23:21:51+00:00,61,QUESTO FOTTUTISSIMO CONCETTO donnalisi  GFvip ,#donnalisi#GFvip,3,0.0,
1597007817294368769,_SoniaRusso,2022-11-27 23:21:49+00:00,57,"Nikita, George, Micol, Edoardo.T e Onestini che si divertono e ridono insieme nel cortiletto è la cosa più bella di questa serata 🤍 gfvip  nikiters  incorvassi",#gfvip#nikiters#incorvassi,3,0.0,George;Micol;Edoardo;Edoardo
1597007800965935105,_SoniaRusso,2022-11-27 23:21:45+00:00,51,"Quanto si vede che Nikita, Micol, Edoardo Tavassi e Luca Onestini lo fanno sentire a proprio agio George, è così bello vederlo sorridere...🤍  gfvip  nikiters  incorvassi",#gfvip#nikiters#incorvassi,3,0.0,Nikita;Edoardo;Edoardo;Luca;Luca;George
1597007777188413440,Nicoettaconcet1,2022-11-27 23:21:39+00:00,23,"""George non parla mai, sta sempre zitto  non si diverte.""Ma colleghiamoci con Antonella in questo momento. gfvip  incorvassi ",#gfvip#incorvassi,3,0.0,George;Antonella
1597007756019396608,Dani24965654,2022-11-27 23:21:34+00:00,0,Cambiate questa rottura...  gfvip   incorvassi,#gfvip#incorvassi,3,0.0,
1597007705847189504,_SoniaRusso,2022-11-27 23:21:22+00:00,23,"tavassi e Micol ripetono a Luca che si è fatto lo sbiancamento a*aleNikita ""Luca va tutto bene non c'è nessun problema questi son gusti""lui si abbassa i pantaloni per farglielo vedere a tutti ahahahhahahaha  gfvip  nikiters  incorvassi ",#gfvip#nikiters#incorvassi,3,0.0,Micol;Luca;Luca
1597007682409353217,Tiziana58511518,2022-11-27 23:21:17+00:00,10,ANCHE PAMELA PRATI DALLA PARTE DI MICOL ❤️  iostoconmicol  incorvassi  gfvip  GrandeFratelloVip ,#iostoconmicol#incorvassi#gfvip#GrandeFratelloVip,3,0.0,Micol
1597007669218267136,Zizzi03102019,2022-11-27 23:21:13+00:00,21,"sfottono Nikita che sente l'energia delle rocceTavassi a Luca ""capito?Se ti metti con lei torni a casa la trovi a letto co na roccia""Luca ""attilio tu cosa dici?"" ""ti sei mai trombato una roccia?""Attilio ""no in genere io me so fatto male"" 🙈  gfvip  nikiters  incorvassi ",#gfvip#nikiters#incorvassi,3,0.0,Nikita;Luca;Luca;Attilio
1597007666010001408,Veritas55543576,2022-11-27 23:21:13+00:00,0,Giaele svegliati!!! Ci stai ricascando figlia mia… 🤦🏻‍♀️🤦🏻‍♀️🤦🏻‍♀️😭 gfvip  nikiters  donnalisi  incorvassi,#gfvip#nikiters#donnalisi#incorvassi,1,-0.6093,Giaele
1597007659269783552,gieffevippe,2022-11-27 23:21:11+00:00,32,RAGA MA SOLO IO HO UNA VOGLIA MATTA DI VEDERLA FUORI DA QUELLA CASA ??? HA SOLO CATTIVERIA DENTRO QUESTA QUI   Gfvip  incorvassi ,#Gfvip#incorvassi,5,0.568,
1597007645072044033,Amores2022,2022-11-27 23:21:08+00:00,57,"Nikita, George, Micol, Edoardo.T e Onestini che si divertono e ridono insieme nel cortiletto è la cosa più bella di questa serata 🤍 gfvip  nikiters  incorvassi",#gfvip#nikiters#incorvassi,3,0.0,George;Micol;Edoardo;Edoardo
1597007643717304320,Sarina74686551,2022-11-27 23:21:07+00:00,0,Talmente che non vogliono la coppia  incorvassiChe sono disposti anche a perde le inquadrature su Onestini e Nikita gfvip,#incorvassiChe#gfvip,3,0.0,Nikita
1597007620002697216,Duazfan,2022-11-27 23:21:02+00:00,1,lui tira fuori la figlia quando hli fa comodo per uscirne pulito 🤦‍♀️  gfvip  nikiters  incorvassi  donnalisi  gintonic ,#gfvip#nikiters#incorvassi#donnalisi#gintonic,3,0.0,
1597007609131065344,neverlandisin_,2022-11-27 23:20:59+00:00,61,QUESTO FOTTUTISSIMO CONCETTO donnalisi  GFvip ,#donnalisi#GFvip,3,0.0,
1597007604014014464,Tiziana58511518,2022-11-27 23:20:58+00:00,4,Lei è troppo lucida cazzo… LI SGAMA TUTTI. gfvip  incorvassi  salottiners  iostoconmicol ,#gfvip#incorvassi#salottiners#iostoconmicol,3,0.0,
1597007603162550273,nontelhochiesto,2022-11-27 23:20:58+00:00,1,"Spero che dopo le porcate sentite da Wilma, giaele si ricreda su di lei… sul serio…  incorvassi  nikiters  gfvip",#incorvassi#nikiters#gfvip,3,0.0,Wilma
1597007586599239687,Amores2022,2022-11-27 23:20:54+00:00,31,"“Antonino se ne esce sempre pulito in puntata, fa i casini lui, poi le altre due litigano e lui ne esce sempre bene”Luca Onestini spillando la verità  gfvip  nikiters  incorvassi ",#gfvip#nikiters#incorvassi,3,0.0,Antonino
1597007582396567552,Tiziana58511518,2022-11-27 23:20:53+00:00,8,MIA FIGLIA NON MERITA TUTTO QUESTO. gfvip  incorvassi  gintonic  iostoconmicol ,#gfvip#incorvassi#gintonic#iostoconmicol,2,-0.4466,
1597007559957041152,TToitay,2022-11-27 23:20:47+00:00,2,Vi prego   domani Oriana deve vedere questa conversazione tra Giaele e Antonino così la nostra Oriana torna in se   GFVip  oriana,#GFVip#oriana,3,0.0,Oriana;Giaele;Antonino
1597007557771821057,Tiziana58511518,2022-11-27 23:20:47+00:00,11,"Lei:Bellezza senza voler apparire.Bontà senza avere secondi fini.Semplicità senza macchinazioni.Sensualità senza nudità.Ironia senza cattiveria. Le altre: Invidia, gelosia e perfidia. Ecco qui spiegata l’ossessione. incorvassi  salottiners  GFvip  iostoconmicol ",#incorvassi#salottiners#GFvip#iostoconmicol,3,0.0,
1597007533910429697,Tiziana58511518,2022-11-27 23:20:41+00:00,5, iostoconmicol  gfvip  incorvassi devono prendere provvedimenti 🤞🍀 ,#iostoconmicol#gfvip#incorvassi,3,0.0,
1597007510510383106,nontelhochiesto,2022-11-27 23:20:36+00:00,9,"Questa ragazza è l'ossessione di Bigodino, Tontonella, Elenoire, Cri20+20, donnalisi, gintonic e chi più ne ha più ne metta, scoppieremo i fegati fino alla fine  gfvip  nikita  nikiters ",#gfvip#nikita#nikiters,4,0.4939,
1597007509352771587,LeeinMart,2022-11-27 23:20:35+00:00,1,SE LO MERITA TUTTO  GFVIP  INCORVASSI ,#GFVIP#INCORVASSI,3,0.0,
1597007507729571840,molisangirl,2022-11-27 23:20:35+00:00,61,QUESTO FOTTUTISSIMO CONCETTO donnalisi  GFvip ,#donnalisi#GFvip,3,0.0,
1597007501454872576,Suffo89,2022-11-27 23:20:33+00:00,1,Giaele “10 minuti e andiamo a dormire”Sono 40 minuti che ci impalla una regia.  incorvassi  gfvip,#incorvassi#gfvip,3,0.0,Giaele
1597007497885540352,gieffevippe,2022-11-27 23:20:33+00:00,0,NO MO SBROCCO MALE VE PREGO ... PRIMA 1H DI BILIARDO MO 1H DI SCACCHI ??? MA SERI ?? INCORVASSI  GFVIP,#INCORVASSI#GFVIP,1,-0.5984,
1597007489375277058,_SoniaRusso,2022-11-27 23:20:31+00:00,23,"""George non parla mai, sta sempre zitto  non si diverte.""Ma colleghiamoci con Antonella in questo momento. gfvip  incorvassi ",#gfvip#incorvassi,3,0.0,George;Antonella
1597007466881245184,ArdolinoPina,2022-11-27 23:20:25+00:00,21,"sfottono Nikita che sente l'energia delle rocceTavassi a Luca ""capito?Se ti metti con lei torni a casa la trovi a letto co na roccia""Luca ""attilio tu cosa dici?"" ""ti sei mai trombato una roccia?""Attilio ""no in genere io me so fatto male"" 🙈  gfvip  nikiters  incorvassi ",#gfvip#nikiters#incorvassi,3,0.0,Nikita;Luca;Luca;Attilio
1597007448703143936,testwindyahooi1,2022-11-27 23:20:21+00:00,45,In quella casa TUTTI sparlano di TUTTI 24 ore su 24. Ma viene accusata solo Antonella. In quella casa tutti fanno scivoloni. Ma vengono visti solo quelli di Antonella.Dimmi che sei ossessionato da Antonella senza dirmi che sei ossessionato da lei. 💀 GFVIP  donnalisi ,#GFVIP#donnalisi,3,0.0,Antonella
1597007429610323969,Linkem25,2022-11-27 23:20:16+00:00,0, Giaele che si è stranita perchè  Antonino l' ha paragonata a pari livello delle altre ...invece lei ancora pensa di essere sto cazzo per lui.  GFvip,#Giaele#Antonino#GFvip,4,0.34,Antonino
1597007423537311750,99wo0,2022-11-27 23:20:15+00:00,21,"sfottono Nikita che sente l'energia delle rocceTavassi a Luca ""capito?Se ti metti con lei torni a casa la trovi a letto co na roccia""Luca ""attilio tu cosa dici?"" ""ti sei mai trombato una roccia?""Attilio ""no in genere io me so fatto male"" 🙈  gfvip  nikiters  incorvassi ",#gfvip#nikiters#incorvassi,3,0.0,Nikita;Luca;Luca;Attilio
1597007411801632768,Tiziana58511518,2022-11-27 23:20:12+00:00,5,Non farti mai spegnere questo sorriso 🥹🫶🏻 iostoconmicol  salottiners  INCORVASSI  gfvip ,#iostoconmicol#salottiners#INCORVASSI#gfvip,3,0.0,
1597007389802508288,Li_on000,2022-11-27 23:20:07+00:00,1,SE LO MERITA TUTTO  GFVIP  INCORVASSI ,#GFVIP#INCORVASSI,3,0.0,
1597007377416343553,amati_89,2022-11-27 23:20:04+00:00,11,Edoardo e zia Patty🥰 donnalisi  gfvip ,#donnalisi#gfvip,5,0.8074,Edoardo;Edoardo
1597007358437527552,chhiaraaaa,2022-11-27 23:19:59+00:00,61,QUESTO FOTTUTISSIMO CONCETTO donnalisi  GFvip ,#donnalisi#GFvip,3,0.0,
1597007338304524288,Tiziana58511518,2022-11-27 23:19:55+00:00,12, iostoconmicol Perché non si può far finta di nulla davanti a tutto ciò.  GFvip tutto ciò è inaccettabile!!!  incorvassi ,#iostoconmicol#GFvip#incorvassi,3,0.0,
1597007323729231877,AmorMicchi,2022-11-27 23:19:51+00:00,2,L'incubo peggiore è vedere Fiordiminkia giocare alla scacchiera  incorvassi  gfvip,#incorvassi#gfvip,3,0.0,
1597007322710036480,gaiacolognesi,2022-11-27 23:19:51+00:00,0,io non capisco il senso di staccare il collegamento dal cortiletto dove ridono scherzano per mettere tre che giocano a dama peggio dei pensionati al circolo  gfvip  incorvassi   nikiters,#gfvip#incorvassi#nikiters,3,0.0,
1597007292896944129,testwindyahooi1,2022-11-27 23:19:44+00:00,14,Ma Edo che si mette davanti a lei per proteggerla da un eventuale colpo (che poi si è beccato davvero)? Capite che sono queste le cose che contano e non le chiacchiere? Più uomini come Edoardo Donnamaria al mondo ❤️  donnalisi  GFvip  fiorde ,#donnalisi#GFvip#fiorde,3,0.0,Edoardo;Edoardo
1597007260789932032,FabioAnnicchiar,2022-11-27 23:19:36+00:00,2,L'incubo peggiore è vedere Fiordiminkia giocare alla scacchiera  incorvassi  gfvip,#incorvassi#gfvip,3,0.0,
1597007246130806784,Dolcebimba83,2022-11-27 23:19:33+00:00,0, vogliamo ridere non ce ne frega di loro che giocano a scacchi  incorvassi  gfvip,#incorvassi#gfvip,3,0.0,
1597007238287478786,Tiziana58511518,2022-11-27 23:19:31+00:00,9,PREPARATE I POPCORN PERCHÉ DOMANI FARANNO TUTTI UNA GRANDE FIGURA DI MERDA.🍿🍿 gintonic  incorvassi  iostoconmicol  gfvip ,#gintonic#incorvassi#iostoconmicol#gfvip,3,0.0,
1597007231333335040,mentaleillness,2022-11-27 23:19:29+00:00,0,"ma perche lo guarda così, cos’havi prego fatela riprendere  gfvip  incorvassi ",#gfvip#incorvassi,3,0.0,
1597007230242783232,vale90453943,2022-11-27 23:19:29+00:00,0,no a lei piace Daniele sisi  gfvip  incorvassi ,#gfvip#incorvassi,2,-0.296,Daniele
1597007211909500928,Buonalacqua,2022-11-27 23:19:24+00:00,23,"""George non parla mai, sta sempre zitto  non si diverte.""Ma colleghiamoci con Antonella in questo momento. gfvip  incorvassi ",#gfvip#incorvassi,3,0.0,George;Antonella
1597007209254498304,Tiziana58511518,2022-11-27 23:19:24+00:00,11,"Clizia come sempre IMPECCABILE nelle parole, ma soprattutto nei significati…💕 iostoconMicol  gfvip  gintonic  incorvassi ",#iostoconMicol#gfvip#gintonic#incorvassi,5,0.6486,
1597007192011390976,Martyfrongillo,2022-11-27 23:19:20+00:00,1,"Spero che dopo le porcate sentite da Wilma, giaele si ricreda su di lei… sul serio…  incorvassi  nikiters  gfvip",#incorvassi#nikiters#gfvip,3,0.0,Wilma
1597007172235579392,BAliceB90,2022-11-27 23:19:15+00:00,4,Nel cortiletto ridono come pazzi mentre Onestini fa vedere a tutti il suo ano. Nel resto della casa mummie e biliardo.  incorvassi  cortiletto  gfvip,#incorvassi#cortiletto#gfvip,3,0.0,
1597007163645624321,Tiziana58511518,2022-11-27 23:19:13+00:00,15,“Spesso la verità da fastidio a molti”BRAVA!  iostoconmicol  gfvip  incorvassi ,#iostoconmicol#gfvip#incorvassi,3,0.0,
1597007158826397702,YoungSignorini_,2022-11-27 23:19:12+00:00,61,QUESTO FOTTUTISSIMO CONCETTO donnalisi  GFvip ,#donnalisi#GFvip,3,0.0,
1597007142346969088,Maria67509026,2022-11-27 23:19:08+00:00,23,"tavassi e Micol ripetono a Luca che si è fatto lo sbiancamento a*aleNikita ""Luca va tutto bene non c'è nessun problema questi son gusti""lui si abbassa i pantaloni per farglielo vedere a tutti ahahahhahahaha  gfvip  nikiters  incorvassi ",#gfvip#nikiters#incorvassi,3,0.0,Micol;Luca;Luca
1597007133471825920,Tiziana58511518,2022-11-27 23:19:06+00:00,24,Solidarietà: incorvassi  iostoconmicol  gfvip ,#incorvassi#iostoconmicol#gfvip,3,0.0,
1597007129625628672,quadrupedepelos,2022-11-27 23:19:05+00:00,2,L'incubo peggiore è vedere Fiordiminkia giocare alla scacchiera  incorvassi  gfvip,#incorvassi#gfvip,3,0.0,
1597007126958067712,nontelhochiesto,2022-11-27 23:19:04+00:00,2,allora le vecchie che dicevano le peggio porcherie si??? e le goliardate nooooo  gfvip fai pace col cervello  incorvassi,#gfvip#incorvassi,3,0.0,
1597007105906511872,Suffo89,2022-11-27 23:18:59+00:00,1,Giaele “10 minuti e andiamo a dormire”Sono 40 minuti che ci impalla una regia.  incorvassi  gfvip,#incorvassi#gfvip,3,0.0,Giaele
1597007070041022464,fray46536377,2022-11-27 23:18:51+00:00,1,Al cortiletto sono arrivati anche attilio e LucianoLuciano sta sdraiato vicino a NikitaOra parlano delle energia che sente NikitaDelle rocce oggi ha sentito l'aurea d GiaeleTav:anche io voglio essere matto... Cmq devi conoscere Diana gfvip  nikiters  ciupilan  incorvassi,#gfvip#nikiters#ciupilan#incorvassi,4,0.34,Luciano;Nikita;Giaele
1597007069684453376,fevdericolucia,2022-11-27 23:18:51+00:00,82,"Antonella: ""Se rimaniamo solo io e George, è come se ci fossi solo io.""Micol: ""Ma George è fortissimo.""ASFALTATA. gfvip  incorvassi",#gfvip#incorvassi,3,0.0,George
1597007037925191680,TrashAddicted,2022-11-27 23:18:43+00:00,21,"sfottono Nikita che sente l'energia delle rocceTavassi a Luca ""capito?Se ti metti con lei torni a casa la trovi a letto co na roccia""Luca ""attilio tu cosa dici?"" ""ti sei mai trombato una roccia?""Attilio ""no in genere io me so fatto male"" 🙈  gfvip  nikiters  incorvassi ",#gfvip#nikiters#incorvassi,3,0.0,Nikita;Luca;Luca;Attilio
1597007010075070464,Tiziana58511518,2022-11-27 23:18:36+00:00,14,“ieri avevo le lacrime in tasca ma non ho ceduto.” 🥺💗 iostoconmicol  incorvassi  gintonic  gfvip ,#iostoconmicol#incorvassi#gintonic#gfvip,5,0.7096,
1597007007453564929,Duazfan,2022-11-27 23:18:36+00:00,20,"Giaele che dice ""che dolce che sei Wilma"" dopo lo schifo che Wilma ha detto su Nikita e Micol (e Giaele lo sa).. e dice che le è dispiaciuto per Elenoir (uscita per lo sputo e la cosa della sfiga).. bah 👎  gfvip  nikiters  incorvassi",#gfvip#nikiters#incorvassi,4,0.34,Giaele;Wilma;Nikita;Micol
1597006977628278785,ciuppina,2022-11-27 23:18:29+00:00,9,Per i donnacrisi Luca cercava scuse per stare lontano da Niki Qui mi sembra tutto tranne che come dicono 👇  gfvip  nikiters  lukita ,#gfvip#nikiters#lukita,3,0.0,Luca;Luca
1597006969185140737,Duazfan,2022-11-27 23:18:27+00:00,23,"""George non parla mai, sta sempre zitto  non si diverte.""Ma colleghiamoci con Antonella in questo momento. gfvip  incorvassi ",#gfvip#incorvassi,3,0.0,George;Antonella
1597006962541355009,Sara30268294,2022-11-27 23:18:25+00:00,0,Regia Cortiletto🕯️🕯️🕯️🕯️🕯️🕯️🕯️🕎🕎🕎🕎🕎🕎🕎🕎🕯️🕯️🕯️🕯️🕯️🕯️🕯️🕯️🕯️🕯️🕯️🕯️🕯️🕯️🕯️🕯️🕯️🕯️🕯️🕯️🕯️🕯️🕯️🕯️🕯️🕯️🕎🕎🕎🕎🕎🕎🕎🕎🕎🕎🕎🕎🕎🕎🕎🕎🕎🕎🕎🕎🕯️🕯️🕯️🕯️🕯️🕯️🕯️🕯️🕯️🕯️🕯️🕯️🕯️🕯️ 🕯️🕯️🕯️🕯️🕯️🕯️🕯️🕯️🕎🕎🕎🕎🕯️🕯️🕯️🕯️🕯️🕎🕎🕎🕎🕎🕯️🕯️🕯️🕯️🕯️🕯️🕯️🕯️🕯️🕯️🕯️🕯️🕯️🕯️🕯️🕎🕎🕎🕎🕯️🕯️🕯️🕯️🕯️🕯️ GFvip  incorvassi,#GFvip#incorvassi,3,0.0,
1597006956598034433,vraietang,2022-11-27 23:18:24+00:00,21,Loro non possono farne a meno  incorvassi  gfvip ,#incorvassi#gfvip,3,0.0,
1597006952328237056,gossipg65060731,2022-11-27 23:18:23+00:00,23,"""George non parla mai, sta sempre zitto  non si diverte.""Ma colleghiamoci con Antonella in questo momento. gfvip  incorvassi ",#gfvip#incorvassi,3,0.0,George;Antonella
1597006949874532352,mandy___23,2022-11-27 23:18:22+00:00,2,Io stavo letteralmente SCHIATTANDO dalle risateeee REGIAAAA CORTILETTOOOO  GFVIP  incorvassi,#GFVIP#incorvassi,3,0.0,
1597006948985368576,Tiziana58511518,2022-11-27 23:18:22+00:00,7,"Nn vi permettete di criticare Clizia... Ha tutto il diritto di difendere sua sorella, dopo che ha ascoltato le oscenità gratuite dette da due persone adulte, che invece di dare l'esempio,stanno regalando uno spettacolo osceno  ciavarrini  gfvip  incorvassi  iostoconmicol 👏♥️ ",#ciavarrini#gfvip#incorvassi#iostoconmicol,5,0.8402,
